[
 {
   "USER_ID": "PullmanRRac469",
   "PERSON_ID": 78200030,
   "EMAIL": "PullmanRRac469@cancer.com",
   "NAME_PREFIX": "",
   "FIRST_NAME": "Rachel",
   "MI_NAME": "R",
   "LAST_NAME": "Pullman",
   "NAME_SUFFIX": "",
   "STATUS_CODE": 1,
   "STATUS_DESCRIP": "Active",
   "ACCOUNT_CREATED_DATE": "06/03/2021 06:55:02",
   "ACCOUNT_UPDATED_DATE": "06/03/2021 07:20:30",
   "ACCOUNT_LAST_LOGIN_DATE": "06/03/2021 07:20:30",
   "LAST_UPDATED_DATE": "06/03/2021 07:20:30",
   "LAST_UPDATED_DAY": "2021-06-03",
   "ORG_ID": 45401,
   "ORG_NAME": "NOGUCHI MEMORIAL INSTITUTE / MEDICAL RES",
   "ORG_ADDRESS_1": "NOGUCHI MEMORIAL INSTITUTE FOR MEDICAL RESEARCH",
   "ORG_ADDRESS_2": "BOX LG 581",
   "ORG_ADDRESS_3": "",
   "ORG_ADDRESS_4": "",
   "ORG_ADDRESS_5": "",
   "CITY": "LEGON",
   "STATE": "",
   "PHONE_NUMBER": "233302501180",
   "ORG_EMAIL": "Director@noguchi.ug.edu.gh"
 },
 {
   "USER_ID": "GrayDDan972",
   "PERSON_ID": 78200038,
   "EMAIL": "GrayDDan972@cancer.com",
   "NAME_PREFIX": "",
   "FIRST_NAME": "Dan",
   "MI_NAME": "D",
   "LAST_NAME": "Gray",
   "NAME_SUFFIX": "",
   "STATUS_CODE": 1,
   "STATUS_DESCRIP": "Active",
   "ACCOUNT_CREATED_DATE": "06/03/2021 07:25:44",
   "ACCOUNT_UPDATED_DATE": "06/03/2021 11:37:31",
   "ACCOUNT_LAST_LOGIN_DATE": "06/03/2021 11:15:13",
   "LAST_UPDATED_DATE": "06/03/2021 11:37:31",
   "LAST_UPDATED_DAY": "2021-06-03",
   "ORG_ID": 45401,
   "ORG_NAME": "NOGUCHI MEMORIAL INSTITUTE / MEDICAL RES",
   "ORG_ADDRESS_1": "NOGUCHI MEMORIAL INSTITUTE FOR MEDICAL RESEARCH",
   "ORG_ADDRESS_2": "BOX LG 581",
   "ORG_ADDRESS_3": "",
   "ORG_ADDRESS_4": "",
   "ORG_ADDRESS_5": "",
   "CITY": "LEGON",
   "STATE": "",
   "PHONE_NUMBER": "233302501180",
   "ORG_EMAIL": "Director@noguchi.ug.edu.gh"
 },
 {
   "USER_ID": "QuinnRRic437",
   "PERSON_ID": 78200026,
   "EMAIL": "QuinnRRic437@cancer.com",
   "NAME_PREFIX": "",
   "FIRST_NAME": "Richard",
   "MI_NAME": "R",
   "LAST_NAME": "Quinn",
   "NAME_SUFFIX": "",
   "STATUS_CODE": 1,
   "STATUS_DESCRIP": "Active",
   "ACCOUNT_CREATED_DATE": "06/03/2021 06:50:27",
   "ACCOUNT_UPDATED_DATE": "06/04/2021 16:04:35",
   "ACCOUNT_LAST_LOGIN_DATE": "06/04/2021 16:04:35",
   "LAST_UPDATED_DATE": "06/04/2021 16:04:35",
   "LAST_UPDATED_DAY": "2021-06-04",
   "ORG_ID": 45401,
   "ORG_NAME": "NOGUCHI MEMORIAL INSTITUTE / MEDICAL RES",
   "ORG_ADDRESS_1": "NOGUCHI MEMORIAL INSTITUTE FOR MEDICAL RESEARCH",
   "ORG_ADDRESS_2": "BOX LG 581",
   "ORG_ADDRESS_3": "",
   "ORG_ADDRESS_4": "",
   "ORG_ADDRESS_5": "",
   "CITY": "LEGON",
   "STATE": "",
   "PHONE_NUMBER": "233302501180",
   "ORG_EMAIL": "Director@noguchi.ug.edu.gh"
 },
 {
   "USER_ID": "LewisCChl503",
   "PERSON_ID": 78215292,
   "EMAIL": "LewisCChl503@cancer.com",
   "NAME_PREFIX": "",
   "FIRST_NAME": "Chloe",
   "MI_NAME": "C",
   "LAST_NAME": "Lewis",
   "NAME_SUFFIX": "",
   "STATUS_CODE": 1,
   "STATUS_DESCRIP": "Active",
   "ACCOUNT_CREATED_DATE": "06/09/2021 10:41:26",
   "ACCOUNT_UPDATED_DATE": "06/09/2021 12:33:54",
   "ACCOUNT_LAST_LOGIN_DATE": "06/09/2021 12:33:54",
   "LAST_UPDATED_DATE": "06/09/2021 12:33:54",
   "LAST_UPDATED_DAY": "2021-06-09",
   "ORG_ID": 46201,
   "ORG_NAME": "UPMC PRESBYTERIAN",
   "ORG_ADDRESS_1": "UPMC",
   "ORG_ADDRESS_2": "600 Grant Street, 58th Floor",
   "ORG_ADDRESS_3": "",
   "ORG_ADDRESS_4": "",
   "ORG_ADDRESS_5": "",
   "CITY": "PITTSBURGH",
   "STATE": "PA",
   "PHONE_NUMBER": "4126474461",
   "ORG_EMAIL": "OSPARS@upmc.edu"
 },
 {
   "USER_ID": "StewartCCha783",
   "PERSON_ID": 78207727,
   "EMAIL": "StewartCCha783@cancer.com",
   "NAME_PREFIX": "",
   "FIRST_NAME": "Charles",
   "MI_NAME": "C",
   "LAST_NAME": "Stewart",
   "NAME_SUFFIX": "",
   "STATUS_CODE": 1,
   "STATUS_DESCRIP": "Active",
   "ACCOUNT_CREATED_DATE": "06/07/2021 08:29:51",
   "ACCOUNT_UPDATED_DATE": "06/07/2021 10:52:44",
   "ACCOUNT_LAST_LOGIN_DATE": "06/07/2021 10:52:44",
   "LAST_UPDATED_DATE": "06/07/2021 10:52:44",
   "LAST_UPDATED_DAY": "2021-06-07",
   "ORG_ID": 46201,
   "ORG_NAME": "UPMC PRESBYTERIAN",
   "ORG_ADDRESS_1": "UPMC",
   "ORG_ADDRESS_2": "600 Grant Street, 58th Floor",
   "ORG_ADDRESS_3": "",
   "ORG_ADDRESS_4": "",
   "ORG_ADDRESS_5": "",
   "CITY": "PITTSBURGH",
   "STATE": "PA",
   "PHONE_NUMBER": "4126474461",
   "ORG_EMAIL": "OSPARS@upmc.edu"
 },
 {
   "USER_ID": "AlsopFFra104",
   "PERSON_ID": 78203090,
   "EMAIL": "AlsopFFra104@cancer.com",
   "NAME_PREFIX": "",
   "FIRST_NAME": "Frank",
   "MI_NAME": "F",
   "LAST_NAME": "Alsop",
   "NAME_SUFFIX": "",
   "STATUS_CODE": 1,
   "STATUS_DESCRIP": "Active",
   "ACCOUNT_CREATED_DATE": "06/04/2021 04:21:30",
   "ACCOUNT_UPDATED_DATE": "06/04/2021 12:35:52",
   "ACCOUNT_LAST_LOGIN_DATE": "06/04/2021 12:35:52",
   "LAST_UPDATED_DATE": "06/04/2021 12:35:52",
   "LAST_UPDATED_DAY": "2021-06-04",
   "ORG_ID": 10041956,
   "ORG_NAME": "CNRS DELEGAION RHONE AUVERGNE",
   "ORG_ADDRESS_1": "CNRS DELEGAION RHONE AUVERGNE",
   "ORG_ADDRESS_2": "2 AVENUE ALBERT EINSTEIN",
   "ORG_ADDRESS_3": "VILLEURBANNE 69609, FRANCE",
   "ORG_ADDRESS_4": "",
   "ORG_ADDRESS_5": "",
   "CITY": "VILLEURBANNE",
   "STATE": "",
   "PHONE_NUMBER": "",
   "ORG_EMAIL": ""
 },
 {
   "USER_ID": "CornishDDia682",
   "PERSON_ID": 78198536,
   "EMAIL": "CornishDDia682@cancer.com",
   "NAME_PREFIX": "",
   "FIRST_NAME": "Diana",
   "MI_NAME": "D",
   "LAST_NAME": "Cornish",
   "NAME_SUFFIX": "",
   "STATUS_CODE": 1,
   "STATUS_DESCRIP": "Active",
   "ACCOUNT_CREATED_DATE": "06/02/2021 13:53:17",
   "ACCOUNT_UPDATED_DATE": "06/03/2021 16:49:57",
   "ACCOUNT_LAST_LOGIN_DATE": "06/03/2021 16:49:57",
   "LAST_UPDATED_DATE": "06/03/2021 16:49:57",
   "LAST_UPDATED_DAY": "2021-06-03",
   "ORG_ID": 1147601,
   "ORG_NAME": "UNIVERSITY OF CAPE TOWN",
   "ORG_ADDRESS_1": "UNIVERSITY OF CAPE TOWN",
   "ORG_ADDRESS_2": "RESEARCH & INNOVATION",
   "ORG_ADDRESS_3": "2 Rhodes Avenue",
   "ORG_ADDRESS_4": "Mowbray, CAPE TOWN 7700, SOUTH AFRICA",
   "ORG_ADDRESS_5": "",
   "CITY": "RONDEBOSCH",
   "STATE": "",
   "PHONE_NUMBER": "27216503865",
   "ORG_EMAIL": "Piet.Barnard@uct.ac.za"
 },
 {
   "USER_ID": "MarshallJJon910",
   "PERSON_ID": 78198524,
   "EMAIL": "MarshallJJon910@cancer.com",
   "NAME_PREFIX": "",
   "FIRST_NAME": "Jonathan",
   "MI_NAME": "J",
   "LAST_NAME": "Marshall",
   "NAME_SUFFIX": "",
   "STATUS_CODE": 1,
   "STATUS_DESCRIP": "Active",
   "ACCOUNT_CREATED_DATE": "06/02/2021 13:52:06",
   "ACCOUNT_UPDATED_DATE": "06/02/2021 14:00:41",
   "ACCOUNT_LAST_LOGIN_DATE": "06/02/2021 14:00:41",
   "LAST_UPDATED_DATE": "06/02/2021 14:00:41",
   "LAST_UPDATED_DAY": "2021-06-02",
   "ORG_ID": 1147601,
   "ORG_NAME": "UNIVERSITY OF CAPE TOWN",
   "ORG_ADDRESS_1": "UNIVERSITY OF CAPE TOWN",
   "ORG_ADDRESS_2": "RESEARCH & INNOVATION",
   "ORG_ADDRESS_3": "2 Rhodes Avenue",
   "ORG_ADDRESS_4": "Mowbray, CAPE TOWN 7700, SOUTH AFRICA",
   "ORG_ADDRESS_5": "",
   "CITY": "RONDEBOSCH",
   "STATE": "",
   "PHONE_NUMBER": "27216503865",
   "ORG_EMAIL": "Piet.Barnard@uct.ac.za"
 },
 {
   "USER_ID": "AllanRReb731",
   "PERSON_ID": 78198551,
   "EMAIL": "AllanRReb731@cancer.com",
   "NAME_PREFIX": "",
   "FIRST_NAME": "Rebecca",
   "MI_NAME": "R",
   "LAST_NAME": "Allan",
   "NAME_SUFFIX": "",
   "STATUS_CODE": 1,
   "STATUS_DESCRIP": "Active",
   "ACCOUNT_CREATED_DATE": "06/02/2021 13:57:54",
   "ACCOUNT_UPDATED_DATE": "06/03/2021 04:24:23",
   "ACCOUNT_LAST_LOGIN_DATE": "06/03/2021 04:24:23",
   "LAST_UPDATED_DATE": "06/03/2021 04:24:23",
   "LAST_UPDATED_DAY": "2021-06-03",
   "ORG_ID": 1147601,
   "ORG_NAME": "UNIVERSITY OF CAPE TOWN",
   "ORG_ADDRESS_1": "UNIVERSITY OF CAPE TOWN",
   "ORG_ADDRESS_2": "RESEARCH & INNOVATION",
   "ORG_ADDRESS_3": "2 Rhodes Avenue",
   "ORG_ADDRESS_4": "Mowbray, CAPE TOWN 7700, SOUTH AFRICA",
   "ORG_ADDRESS_5": "",
   "CITY": "RONDEBOSCH",
   "STATE": "",
   "PHONE_NUMBER": "27216503865",
   "ORG_EMAIL": "Piet.Barnard@uct.ac.za"
 },
 {
   "USER_ID": "WrightAAus657",
   "PERSON_ID": 78219386,
   "EMAIL": "WrightAAus657@cancer.com",
   "NAME_PREFIX": "Ms",
   "FIRST_NAME": "Austin",
   "MI_NAME": "A",
   "LAST_NAME": "Wright",
   "NAME_SUFFIX": "",
   "STATUS_CODE": 1,
   "STATUS_DESCRIP": "Active",
   "ACCOUNT_CREATED_DATE": "06/11/2021 03:04:26",
   "ACCOUNT_UPDATED_DATE": "06/11/2021 12:34:55",
   "ACCOUNT_LAST_LOGIN_DATE": "06/11/2021 12:16:37",
   "LAST_UPDATED_DATE": "06/11/2021 12:34:55",
   "LAST_UPDATED_DAY": "2021-06-11",
   "ORG_ID": 1147601,
   "ORG_NAME": "UNIVERSITY OF CAPE TOWN",
   "ORG_ADDRESS_1": "UNIVERSITY OF CAPE TOWN",
   "ORG_ADDRESS_2": "RESEARCH & INNOVATION",
   "ORG_ADDRESS_3": "2 Rhodes Avenue",
   "ORG_ADDRESS_4": "Mowbray, CAPE TOWN 7700, SOUTH AFRICA",
   "ORG_ADDRESS_5": "",
   "CITY": "RONDEBOSCH",
   "STATE": "",
   "PHONE_NUMBER": "27216503865",
   "ORG_EMAIL": "Piet.Barnard@uct.ac.za"
 },
 {
   "USER_ID": "RobertsonBBri196",
   "PERSON_ID": 78198540,
   "EMAIL": "RobertsonBBri196@cancer.com",
   "NAME_PREFIX": "",
   "FIRST_NAME": "Brian",
   "MI_NAME": "B",
   "LAST_NAME": "Robertson",
   "NAME_SUFFIX": "",
   "STATUS_CODE": 1,
   "STATUS_DESCRIP": "Active",
   "ACCOUNT_CREATED_DATE": "06/02/2021 13:54:27",
   "ACCOUNT_UPDATED_DATE": "",
   "ACCOUNT_LAST_LOGIN_DATE": "",
   "LAST_UPDATED_DATE": "06/02/2021 13:54:27",
   "LAST_UPDATED_DAY": "2021-06-02",
   "ORG_ID": 1147601,
   "ORG_NAME": "UNIVERSITY OF CAPE TOWN",
   "ORG_ADDRESS_1": "UNIVERSITY OF CAPE TOWN",
   "ORG_ADDRESS_2": "RESEARCH & INNOVATION",
   "ORG_ADDRESS_3": "2 Rhodes Avenue",
   "ORG_ADDRESS_4": "Mowbray, CAPE TOWN 7700, SOUTH AFRICA",
   "ORG_ADDRESS_5": "",
   "CITY": "RONDEBOSCH",
   "STATE": "",
   "PHONE_NUMBER": "27216503865",
   "ORG_EMAIL": "Piet.Barnard@uct.ac.za"
 },
 {
   "USER_ID": "MacLeodWWil709",
   "PERSON_ID": 78198544,
   "EMAIL": "MacLeodWWil709@cancer.com",
   "NAME_PREFIX": "",
   "FIRST_NAME": "William",
   "MI_NAME": "W",
   "LAST_NAME": "MacLeod",
   "NAME_SUFFIX": "",
   "STATUS_CODE": 1,
   "STATUS_DESCRIP": "Active",
   "ACCOUNT_CREATED_DATE": "06/02/2021 13:55:26",
   "ACCOUNT_UPDATED_DATE": "06/02/2021 14:42:48",
   "ACCOUNT_LAST_LOGIN_DATE": "06/02/2021 14:42:48",
   "LAST_UPDATED_DATE": "06/02/2021 14:42:48",
   "LAST_UPDATED_DAY": "2021-06-02",
   "ORG_ID": 1147601,
   "ORG_NAME": "UNIVERSITY OF CAPE TOWN",
   "ORG_ADDRESS_1": "UNIVERSITY OF CAPE TOWN",
   "ORG_ADDRESS_2": "RESEARCH & INNOVATION",
   "ORG_ADDRESS_3": "2 Rhodes Avenue",
   "ORG_ADDRESS_4": "Mowbray, CAPE TOWN 7700, SOUTH AFRICA",
   "ORG_ADDRESS_5": "",
   "CITY": "RONDEBOSCH",
   "STATE": "",
   "PHONE_NUMBER": "27216503865",
   "ORG_EMAIL": "Piet.Barnard@uct.ac.za"
 },
 {
   "USER_ID": "TuckerAAle373",
   "PERSON_ID": 78198545,
   "EMAIL": "TuckerAAle373@cancer.com",
   "NAME_PREFIX": "",
   "FIRST_NAME": "Alexandra",
   "MI_NAME": "A",
   "LAST_NAME": "Tucker",
   "NAME_SUFFIX": "",
   "STATUS_CODE": 1,
   "STATUS_DESCRIP": "Active",
   "ACCOUNT_CREATED_DATE": "06/02/2021 13:56:39",
   "ACCOUNT_UPDATED_DATE": "",
   "ACCOUNT_LAST_LOGIN_DATE": "",
   "LAST_UPDATED_DATE": "06/02/2021 13:56:39",
   "LAST_UPDATED_DAY": "2021-06-02",
   "ORG_ID": 1147601,
   "ORG_NAME": "UNIVERSITY OF CAPE TOWN",
   "ORG_ADDRESS_1": "UNIVERSITY OF CAPE TOWN",
   "ORG_ADDRESS_2": "RESEARCH & INNOVATION",
   "ORG_ADDRESS_3": "2 Rhodes Avenue",
   "ORG_ADDRESS_4": "Mowbray, CAPE TOWN 7700, SOUTH AFRICA",
   "ORG_ADDRESS_5": "",
   "CITY": "RONDEBOSCH",
   "STATE": "",
   "PHONE_NUMBER": "27216503865",
   "ORG_EMAIL": "Piet.Barnard@uct.ac.za"
 },
 {
   "USER_ID": "TurnerSSar494",
   "PERSON_ID": 78224699,
   "EMAIL": "TurnerSSar494@cancer.com",
   "NAME_PREFIX": "",
   "FIRST_NAME": "Sarah",
   "MI_NAME": "S",
   "LAST_NAME": "Turner",
   "NAME_SUFFIX": "",
   "STATUS_CODE": 1,
   "STATUS_DESCRIP": "Active",
   "ACCOUNT_CREATED_DATE": "06/15/2021 05:31:17",
   "ACCOUNT_UPDATED_DATE": "06/15/2021 10:22:10",
   "ACCOUNT_LAST_LOGIN_DATE": "06/15/2021 09:57:03",
   "LAST_UPDATED_DATE": "06/15/2021 10:22:10",
   "LAST_UPDATED_DAY": "2021-06-15",
   "ORG_ID": 1147601,
   "ORG_NAME": "UNIVERSITY OF CAPE TOWN",
   "ORG_ADDRESS_1": "UNIVERSITY OF CAPE TOWN",
   "ORG_ADDRESS_2": "RESEARCH & INNOVATION",
   "ORG_ADDRESS_3": "2 Rhodes Avenue",
   "ORG_ADDRESS_4": "Mowbray, CAPE TOWN 7700, SOUTH AFRICA",
   "ORG_ADDRESS_5": "",
   "CITY": "RONDEBOSCH",
   "STATE": "",
   "PHONE_NUMBER": "27216503865",
   "ORG_EMAIL": "Piet.Barnard@uct.ac.za"
 },
 {
   "USER_ID": "PetersCCam490",
   "PERSON_ID": 78199106,
   "EMAIL": "PetersCCam490@cancer.com",
   "NAME_PREFIX": "Dr",
   "FIRST_NAME": "Cameron",
   "MI_NAME": "C",
   "LAST_NAME": "Peters",
   "NAME_SUFFIX": "",
   "STATUS_CODE": 1,
   "STATUS_DESCRIP": "Active",
   "ACCOUNT_CREATED_DATE": "06/02/2021 16:29:36",
   "ACCOUNT_UPDATED_DATE": "06/02/2021 22:30:34",
   "ACCOUNT_LAST_LOGIN_DATE": "06/02/2021 22:15:42",
   "LAST_UPDATED_DATE": "06/02/2021 22:30:34",
   "LAST_UPDATED_DAY": "2021-06-02",
   "ORG_ID": 577907,
   "ORG_NAME": "LOUISIANA STATE UNIV A&M COL BATON ROUGE",
   "ORG_ADDRESS_1": "LOUISIANA STATE UNIV A&M COL BATON ROUGE",
   "ORG_ADDRESS_2": "202 Himes Hall",
   "ORG_ADDRESS_3": "",
   "ORG_ADDRESS_4": "",
   "ORG_ADDRESS_5": "",
   "CITY": "BATON ROUGE",
   "STATE": "LA",
   "PHONE_NUMBER": "2255782760",
   "ORG_EMAIL": "osp@lsu.edu"
 },
 {
   "USER_ID": "MacDonaldJJas859",
   "PERSON_ID": 78215154,
   "EMAIL": "MacDonaldJJas859@cancer.com",
   "NAME_PREFIX": "",
   "FIRST_NAME": "Jason",
   "MI_NAME": "J",
   "LAST_NAME": "MacDonald",
   "NAME_SUFFIX": "",
   "STATUS_CODE": 1,
   "STATUS_DESCRIP": "Active",
   "ACCOUNT_CREATED_DATE": "06/09/2021 09:23:29",
   "ACCOUNT_UPDATED_DATE": "",
   "ACCOUNT_LAST_LOGIN_DATE": "",
   "LAST_UPDATED_DATE": "06/09/2021 09:23:29",
   "LAST_UPDATED_DAY": "2021-06-09",
   "ORG_ID": 10009421,
   "ORG_NAME": "CARILION MEDICAL CENTER",
   "ORG_ADDRESS_1": "CARILION MEDICAL CENTER",
   "ORG_ADDRESS_2": "1906 BELLEVIEW AVE SE",
   "ORG_ADDRESS_3": "",
   "ORG_ADDRESS_4": "",
   "ORG_ADDRESS_5": "",
   "CITY": "ROANOKE",
   "STATE": "VA",
   "PHONE_NUMBER": "5408530597",
   "ORG_EMAIL": "VLHOLLEN@carilionclinic.org"
 },
 {
   "USER_ID": "McLeanKKat263",
   "PERSON_ID": 78207835,
   "EMAIL": "McLeanKKat263@cancer.com",
   "NAME_PREFIX": "",
   "FIRST_NAME": "Katherine",
   "MI_NAME": "K",
   "LAST_NAME": "McLean",
   "NAME_SUFFIX": "",
   "STATUS_CODE": 1,
   "STATUS_DESCRIP": "Active",
   "ACCOUNT_CREATED_DATE": "06/07/2021 09:07:55",
   "ACCOUNT_UPDATED_DATE": "",
   "ACCOUNT_LAST_LOGIN_DATE": "",
   "LAST_UPDATED_DATE": "06/07/2021 09:07:55",
   "LAST_UPDATED_DAY": "2021-06-07",
   "ORG_ID": 10009421,
   "ORG_NAME": "CARILION MEDICAL CENTER",
   "ORG_ADDRESS_1": "CARILION MEDICAL CENTER",
   "ORG_ADDRESS_2": "1906 BELLEVIEW AVE SE",
   "ORG_ADDRESS_3": "",
   "ORG_ADDRESS_4": "",
   "ORG_ADDRESS_5": "",
   "CITY": "ROANOKE",
   "STATE": "VA",
   "PHONE_NUMBER": "5408530597",
   "ORG_EMAIL": "VLHOLLEN@carilionclinic.org"
 },
 {
   "USER_ID": "PullmanBBra722",
   "PERSON_ID": 78219392,
   "EMAIL": "PullmanBBra722@cancer.com",
   "NAME_PREFIX": "",
   "FIRST_NAME": "Brandon",
   "MI_NAME": "B",
   "LAST_NAME": "Pullman",
   "NAME_SUFFIX": "",
   "STATUS_CODE": 1,
   "STATUS_DESCRIP": "Active",
   "ACCOUNT_CREATED_DATE": "06/11/2021 04:16:07",
   "ACCOUNT_UPDATED_DATE": "",
   "ACCOUNT_LAST_LOGIN_DATE": "",
   "LAST_UPDATED_DATE": "06/11/2021 04:16:07",
   "LAST_UPDATED_DAY": "2021-06-11",
   "ORG_ID": 513607,
   "ORG_NAME": "CALIFORNIA STATE UNIV SAN BERNARDINO",
   "ORG_ADDRESS_1": "CALIFORNIA STATE UNIV SAN BERNARDINO",
   "ORG_ADDRESS_2": "5500 UNIVERSITY PKY",
   "ORG_ADDRESS_3": "",
   "ORG_ADDRESS_4": "",
   "ORG_ADDRESS_5": "",
   "CITY": "SAN BERNARDINO",
   "STATE": "CA",
   "PHONE_NUMBER": "9095375929",
   "ORG_EMAIL": "dianet@CSUSB.EDU"
 },
 {
   "USER_ID": "RandallBBel857",
   "PERSON_ID": 78222039,
   "EMAIL": "RandallBBel857@cancer.com",
   "NAME_PREFIX": "",
   "FIRST_NAME": "Bella",
   "MI_NAME": "B",
   "LAST_NAME": "Randall",
   "NAME_SUFFIX": "",
   "STATUS_CODE": 1,
   "STATUS_DESCRIP": "Active",
   "ACCOUNT_CREATED_DATE": "06/14/2021 10:11:41",
   "ACCOUNT_UPDATED_DATE": "06/14/2021 13:17:06",
   "ACCOUNT_LAST_LOGIN_DATE": "06/14/2021 13:17:06",
   "LAST_UPDATED_DATE": "06/14/2021 13:17:06",
   "LAST_UPDATED_DAY": "2021-06-14",
   "ORG_ID": 10024654,
   "ORG_NAME": "PLEX PHARMACEUTICALS, INC.",
   "ORG_ADDRESS_1": "CALASIA PHARMACEUTICALS, INC.",
   "ORG_ADDRESS_2": "6330 Nancy Ridge Drive",
   "ORG_ADDRESS_3": "Suite 102",
   "ORG_ADDRESS_4": "",
   "ORG_ADDRESS_5": "",
   "CITY": "SAN DIEGO",
   "STATE": "CA",
   "PHONE_NUMBER": "8585878800",
   "ORG_EMAIL": "sprasad@calasiapharma.com"
 },
 {
   "USER_ID": "MayLLea301",
   "PERSON_ID": 78222050,
   "EMAIL": "MayLLea301@cancer.com",
   "NAME_PREFIX": "",
   "FIRST_NAME": "Leah",
   "MI_NAME": "L",
   "LAST_NAME": "May",
   "NAME_SUFFIX": "",
   "STATUS_CODE": 1,
   "STATUS_DESCRIP": "Active",
   "ACCOUNT_CREATED_DATE": "06/14/2021 10:14:12",
   "ACCOUNT_UPDATED_DATE": "06/14/2021 15:20:32",
   "ACCOUNT_LAST_LOGIN_DATE": "06/14/2021 15:20:32",
   "LAST_UPDATED_DATE": "06/14/2021 15:20:32",
   "LAST_UPDATED_DAY": "2021-06-14",
   "ORG_ID": 10024654,
   "ORG_NAME": "PLEX PHARMACEUTICALS, INC.",
   "ORG_ADDRESS_1": "CALASIA PHARMACEUTICALS, INC.",
   "ORG_ADDRESS_2": "6330 Nancy Ridge Drive",
   "ORG_ADDRESS_3": "Suite 102",
   "ORG_ADDRESS_4": "",
   "ORG_ADDRESS_5": "",
   "CITY": "SAN DIEGO",
   "STATE": "CA",
   "PHONE_NUMBER": "8585878800",
   "ORG_EMAIL": "sprasad@calasiapharma.com"
 },
 {
   "USER_ID": "PowellRRic915",
   "PERSON_ID": 78218651,
   "EMAIL": "PowellRRic915@cancer.com",
   "NAME_PREFIX": "",
   "FIRST_NAME": "Richard",
   "MI_NAME": "R",
   "LAST_NAME": "Powell",
   "NAME_SUFFIX": "",
   "STATUS_CODE": 1,
   "STATUS_DESCRIP": "Active",
   "ACCOUNT_CREATED_DATE": "06/10/2021 18:26:18",
   "ACCOUNT_UPDATED_DATE": "06/10/2021 18:30:15",
   "ACCOUNT_LAST_LOGIN_DATE": "06/10/2021 18:30:15",
   "LAST_UPDATED_DATE": "06/10/2021 18:30:15",
   "LAST_UPDATED_DAY": "2021-06-10",
   "ORG_ID": 10023027,
   "ORG_NAME": "SAGE BIONETWORKS",
   "ORG_ADDRESS_1": "SAGE BIONETWORKS",
   "ORG_ADDRESS_2": "2901 Third Ave, Suite 300",
   "ORG_ADDRESS_3": "",
   "ORG_ADDRESS_4": "",
   "ORG_ADDRESS_5": "",
   "CITY": "SEATTLE",
   "STATE": "WA",
   "PHONE_NUMBER": "2069288250",
   "ORG_EMAIL": "grants@sagebase.org"
 },
 {
   "USER_ID": "HamiltonSSue292",
   "PERSON_ID": 78204912,
   "EMAIL": "HamiltonSSue292@cancer.com",
   "NAME_PREFIX": "",
   "FIRST_NAME": "Sue",
   "MI_NAME": "S",
   "LAST_NAME": "Hamilton",
   "NAME_SUFFIX": "",
   "STATUS_CODE": 1,
   "STATUS_DESCRIP": "Active",
   "ACCOUNT_CREATED_DATE": "06/04/2021 14:22:02",
   "ACCOUNT_UPDATED_DATE": "06/04/2021 17:44:35",
   "ACCOUNT_LAST_LOGIN_DATE": "06/04/2021 17:44:35",
   "LAST_UPDATED_DATE": "06/04/2021 17:44:35",
   "LAST_UPDATED_DAY": "2021-06-04",
   "ORG_ID": 10024695,
   "ORG_NAME": "GORGAS MEMORIAL INSTITUTE OF HEALTH ST",
   "ORG_ADDRESS_1": "JUSTO AROSEMENA AVENUE",
   "ORG_ADDRESS_2": "35TH STREET",
   "ORG_ADDRESS_3": "",
   "ORG_ADDRESS_4": "",
   "ORG_ADDRESS_5": "",
   "CITY": "PANAMA",
   "STATE": "",
   "PHONE_NUMBER": "5075274992",
   "ORG_EMAIL": "drnsosa@gmail.com"
 },
 {
   "USER_ID": "SharpKKat972",
   "PERSON_ID": 78225766,
   "EMAIL": "SharpKKat972@cancer.com",
   "NAME_PREFIX": "",
   "FIRST_NAME": "Katherine",
   "MI_NAME": "K",
   "LAST_NAME": "Sharp",
   "NAME_SUFFIX": "",
   "STATUS_CODE": 1,
   "STATUS_DESCRIP": "Active",
   "ACCOUNT_CREATED_DATE": "06/15/2021 13:34:12",
   "ACCOUNT_UPDATED_DATE": "06/15/2021 13:45:25",
   "ACCOUNT_LAST_LOGIN_DATE": "06/15/2021 13:45:25",
   "LAST_UPDATED_DATE": "06/15/2021 13:45:25",
   "LAST_UPDATED_DAY": "2021-06-15",
   "ORG_ID": 10025390,
   "ORG_NAME": "CENTRAL COUNCIL TLINGIT AND HAIDA INDIAN TRIBES OF ALASKA (CCTHITA)",
   "ORG_ADDRESS_1": "9097 Glacier Hwy",
   "ORG_ADDRESS_2": "",
   "ORG_ADDRESS_3": "",
   "ORG_ADDRESS_4": "",
   "ORG_ADDRESS_5": "",
   "CITY": "JUNEAU",
   "STATE": "AK",
   "PHONE_NUMBER": "9074637108",
   "ORG_EMAIL": "tbelton@ccthita-nsn.gov"
 },
 {
   "USER_ID": "BlackAAnn783",
   "PERSON_ID": 78195922,
   "EMAIL": "BlackAAnn783@cancer.com",
   "NAME_PREFIX": "",
   "FIRST_NAME": "Anne",
   "MI_NAME": "A",
   "LAST_NAME": "Black",
   "NAME_SUFFIX": "",
   "STATUS_CODE": 1,
   "STATUS_DESCRIP": "Active",
   "ACCOUNT_CREATED_DATE": "06/01/2021 11:40:45",
   "ACCOUNT_UPDATED_DATE": "06/01/2021 14:29:58",
   "ACCOUNT_LAST_LOGIN_DATE": "06/01/2021 14:29:58",
   "LAST_UPDATED_DATE": "06/01/2021 14:29:58",
   "LAST_UPDATED_DAY": "2021-06-01",
   "ORG_ID": 10031164,
   "ORG_NAME": "UNIVERSITY OF GHANA",
   "ORG_ADDRESS_1": "UNIVERSITY OF GHANA, LEGON",
   "ORG_ADDRESS_2": "",
   "ORG_ADDRESS_3": "",
   "ORG_ADDRESS_4": "",
   "ORG_ADDRESS_5": "",
   "CITY": "LEGON",
   "STATE": "",
   "PHONE_NUMBER": "(+233)303930436",
   "ORG_EMAIL": "orid-researchadmin@ug.edu.gh"
 },
 {
   "USER_ID": "MackayCChr729",
   "PERSON_ID": 78208134,
   "EMAIL": "MackayCChr729@cancer.com",
   "NAME_PREFIX": "",
   "FIRST_NAME": "Christopher",
   "MI_NAME": "C",
   "LAST_NAME": "Mackay",
   "NAME_SUFFIX": "",
   "STATUS_CODE": 1,
   "STATUS_DESCRIP": "Active",
   "ACCOUNT_CREATED_DATE": "06/07/2021 10:09:21",
   "ACCOUNT_UPDATED_DATE": "06/09/2021 02:04:42",
   "ACCOUNT_LAST_LOGIN_DATE": "06/09/2021 02:04:42",
   "LAST_UPDATED_DATE": "06/09/2021 02:04:42",
   "LAST_UPDATED_DAY": "2021-06-09",
   "ORG_ID": 10031164,
   "ORG_NAME": "UNIVERSITY OF GHANA",
   "ORG_ADDRESS_1": "UNIVERSITY OF GHANA, LEGON",
   "ORG_ADDRESS_2": "",
   "ORG_ADDRESS_3": "",
   "ORG_ADDRESS_4": "",
   "ORG_ADDRESS_5": "",
   "CITY": "LEGON",
   "STATE": "",
   "PHONE_NUMBER": "(+233)303930436",
   "ORG_EMAIL": "orid-researchadmin@ug.edu.gh"
 },
 {
   "USER_ID": "ForsythOOwe859",
   "PERSON_ID": 78221800,
   "EMAIL": "ForsythOOwe859@cancer.com",
   "NAME_PREFIX": "",
   "FIRST_NAME": "Owen",
   "MI_NAME": "O",
   "LAST_NAME": "Forsyth",
   "NAME_SUFFIX": "",
   "STATUS_CODE": 1,
   "STATUS_DESCRIP": "Active",
   "ACCOUNT_CREATED_DATE": "06/14/2021 07:13:28",
   "ACCOUNT_UPDATED_DATE": "",
   "ACCOUNT_LAST_LOGIN_DATE": "",
   "LAST_UPDATED_DATE": "06/14/2021 07:13:28",
   "LAST_UPDATED_DAY": "2021-06-14",
   "ORG_ID": 10031164,
   "ORG_NAME": "UNIVERSITY OF GHANA",
   "ORG_ADDRESS_1": "UNIVERSITY OF GHANA, LEGON",
   "ORG_ADDRESS_2": "",
   "ORG_ADDRESS_3": "",
   "ORG_ADDRESS_4": "",
   "ORG_ADDRESS_5": "",
   "CITY": "LEGON",
   "STATE": "",
   "PHONE_NUMBER": "(+233)303930436",
   "ORG_EMAIL": "orid-researchadmin@ug.edu.gh"
 },
 {
   "USER_ID": "ReidVVic620",
   "PERSON_ID": 78195903,
   "EMAIL": "ReidVVic620@cancer.com",
   "NAME_PREFIX": "",
   "FIRST_NAME": "Victor",
   "MI_NAME": "V",
   "LAST_NAME": "Reid",
   "NAME_SUFFIX": "",
   "STATUS_CODE": 1,
   "STATUS_DESCRIP": "Active",
   "ACCOUNT_CREATED_DATE": "06/01/2021 11:36:23",
   "ACCOUNT_UPDATED_DATE": "06/09/2021 12:42:43",
   "ACCOUNT_LAST_LOGIN_DATE": "06/09/2021 12:42:43",
   "LAST_UPDATED_DATE": "06/09/2021 12:42:43",
   "LAST_UPDATED_DAY": "2021-06-09",
   "ORG_ID": 10031164,
   "ORG_NAME": "UNIVERSITY OF GHANA",
   "ORG_ADDRESS_1": "UNIVERSITY OF GHANA, LEGON",
   "ORG_ADDRESS_2": "",
   "ORG_ADDRESS_3": "",
   "ORG_ADDRESS_4": "",
   "ORG_ADDRESS_5": "",
   "CITY": "LEGON",
   "STATE": "",
   "PHONE_NUMBER": "(+233)303930436",
   "ORG_EMAIL": "orid-researchadmin@ug.edu.gh"
 },
 {
   "USER_ID": "DaviesKKev569",
   "PERSON_ID": 78202627,
   "EMAIL": "DaviesKKev569@cancer.com",
   "NAME_PREFIX": "",
   "FIRST_NAME": "Kevin",
   "MI_NAME": "K",
   "LAST_NAME": "Davies",
   "NAME_SUFFIX": "",
   "STATUS_CODE": 1,
   "STATUS_DESCRIP": "Active",
   "ACCOUNT_CREATED_DATE": "06/03/2021 23:25:30",
   "ACCOUNT_UPDATED_DATE": "06/04/2021 00:15:56",
   "ACCOUNT_LAST_LOGIN_DATE": "06/04/2021 00:15:56",
   "LAST_UPDATED_DATE": "06/04/2021 00:15:56",
   "LAST_UPDATED_DAY": "2021-06-04",
   "ORG_ID": 10031165,
   "ORG_NAME": "ATYR PHARMA, INC.",
   "ORG_ADDRESS_1": "ATYR PHARMA, INC.",
   "ORG_ADDRESS_2": "3545 John Hopkins Court, Suite 250",
   "ORG_ADDRESS_3": "",
   "ORG_ADDRESS_4": "",
   "ORG_ADDRESS_5": "",
   "CITY": "SAN DIEGO",
   "STATE": "CA",
   "PHONE_NUMBER": "8587318389",
   "ORG_EMAIL": "acubitt@atyrpharma.com"
 },
 {
   "USER_ID": "GrantCCar448",
   "PERSON_ID": 78198835,
   "EMAIL": "GrantCCar448@cancer.com",
   "NAME_PREFIX": "",
   "FIRST_NAME": "Carolyn",
   "MI_NAME": "C",
   "LAST_NAME": "Grant",
   "NAME_SUFFIX": "",
   "STATUS_CODE": 1,
   "STATUS_DESCRIP": "Active",
   "ACCOUNT_CREATED_DATE": "06/02/2021 15:16:01",
   "ACCOUNT_UPDATED_DATE": "06/15/2021 13:32:06",
   "ACCOUNT_LAST_LOGIN_DATE": "06/15/2021 13:32:06",
   "LAST_UPDATED_DATE": "06/15/2021 13:32:06",
   "LAST_UPDATED_DAY": "2021-06-15",
   "ORG_ID": 10043154,
   "ORG_NAME": "CENTRAL TEXAS VETERANS RESEARCH FOUNDATION",
   "ORG_ADDRESS_1": "CENTRAL TEXAS VETERANS RESEARCH FOUNDATION",
   "ORG_ADDRESS_2": "1901 S 1ST",
   "ORG_ADDRESS_3": "",
   "ORG_ADDRESS_4": "",
   "ORG_ADDRESS_5": "",
   "CITY": "TEMPLE",
   "STATE": "TX",
   "PHONE_NUMBER": "2547242295",
   "ORG_EMAIL": "mark.heitman@va.gov"
 },
 {
   "USER_ID": "WrightSSal310",
   "PERSON_ID": 78198277,
   "EMAIL": "WrightSSal310@cancer.com",
   "NAME_PREFIX": "Dr",
   "FIRST_NAME": "Sally",
   "MI_NAME": "S",
   "LAST_NAME": "Wright",
   "NAME_SUFFIX": "",
   "STATUS_CODE": 1,
   "STATUS_DESCRIP": "Active",
   "ACCOUNT_CREATED_DATE": "06/02/2021 12:18:19",
   "ACCOUNT_UPDATED_DATE": "06/16/2021 00:52:20",
   "ACCOUNT_LAST_LOGIN_DATE": "06/16/2021 00:52:20",
   "LAST_UPDATED_DATE": "06/16/2021 00:52:20",
   "LAST_UPDATED_DAY": "2021-06-16",
   "ORG_ID": 10040515,
   "ORG_NAME": "NATIONAL INSTITUTE FOR CANCER CONTROL",
   "ORG_ADDRESS_1": "NATIONAL INSTITUTE FOR CANCER CONTROL",
   "ORG_ADDRESS_2": "43 QUAN SU ST, HANG BONG WARD, HOAN KIEM DISTRICT",
   "ORG_ADDRESS_3": "",
   "ORG_ADDRESS_4": "",
   "ORG_ADDRESS_5": "",
   "CITY": "HANOI",
   "STATE": "",
   "PHONE_NUMBER": "84913541632",
   "ORG_EMAIL": "drthuan1970@gmail.com"
 },
 {
   "USER_ID": "JohnstonBBer841",
   "PERSON_ID": 78209292,
   "EMAIL": "JohnstonBBer841@cancer.com",
   "NAME_PREFIX": "Dr",
   "FIRST_NAME": "Bernadette",
   "MI_NAME": "B",
   "LAST_NAME": "Johnston",
   "NAME_SUFFIX": "",
   "STATUS_CODE": 1,
   "STATUS_DESCRIP": "Active",
   "ACCOUNT_CREATED_DATE": "06/07/2021 12:58:41",
   "ACCOUNT_UPDATED_DATE": "06/07/2021 18:29:36",
   "ACCOUNT_LAST_LOGIN_DATE": "06/07/2021 18:28:35",
   "LAST_UPDATED_DATE": "06/07/2021 18:29:36",
   "LAST_UPDATED_DAY": "2021-06-07",
   "ORG_ID": 10041034,
   "ORG_NAME": "FACULDADE DE MEDICINA DE SAO JOSE DO RIO PRETO",
   "ORG_ADDRESS_1": "FACULDADE DE MEDICINA DE SAO JOSE DO RIO PRETO",
   "ORG_ADDRESS_2": "AV BRIDGADEIRO FARIA LIMA 4516",
   "ORG_ADDRESS_3": "",
   "ORG_ADDRESS_4": "",
   "ORG_ADDRESS_5": "",
   "CITY": "SAO JOSE DO RI PRETO",
   "STATE": "",
   "PHONE_NUMBER": "551732015731",
   "ORG_EMAIL": "mnogueira@famerp.br"
 },
 {
   "USER_ID": "McGrathAAbi666",
   "PERSON_ID": 78209312,
   "EMAIL": "McGrathAAbi666@cancer.com",
   "NAME_PREFIX": "Dr",
   "FIRST_NAME": "Abigail",
   "MI_NAME": "A",
   "LAST_NAME": "McGrath",
   "NAME_SUFFIX": "",
   "STATUS_CODE": 1,
   "STATUS_DESCRIP": "Active",
   "ACCOUNT_CREATED_DATE": "06/07/2021 13:00:28",
   "ACCOUNT_UPDATED_DATE": "06/07/2021 15:22:19",
   "ACCOUNT_LAST_LOGIN_DATE": "06/07/2021 15:22:19",
   "LAST_UPDATED_DATE": "06/07/2021 15:22:19",
   "LAST_UPDATED_DAY": "2021-06-07",
   "ORG_ID": 10041034,
   "ORG_NAME": "FACULDADE DE MEDICINA DE SAO JOSE DO RIO PRETO",
   "ORG_ADDRESS_1": "FACULDADE DE MEDICINA DE SAO JOSE DO RIO PRETO",
   "ORG_ADDRESS_2": "AV BRIDGADEIRO FARIA LIMA 4516",
   "ORG_ADDRESS_3": "",
   "ORG_ADDRESS_4": "",
   "ORG_ADDRESS_5": "",
   "CITY": "SAO JOSE DO RI PRETO",
   "STATE": "",
   "PHONE_NUMBER": "551732015731",
   "ORG_EMAIL": "mnogueira@famerp.br"
 },
 {
   "USER_ID": "AbrahamRReb951",
   "PERSON_ID": 78198644,
   "EMAIL": "AbrahamRReb951@cancer.com",
   "NAME_PREFIX": "",
   "FIRST_NAME": "Rebecca",
   "MI_NAME": "R",
   "LAST_NAME": "Abraham",
   "NAME_SUFFIX": "",
   "STATUS_CODE": 1,
   "STATUS_DESCRIP": "Active",
   "ACCOUNT_CREATED_DATE": "06/02/2021 14:27:23",
   "ACCOUNT_UPDATED_DATE": "06/03/2021 13:34:58",
   "ACCOUNT_LAST_LOGIN_DATE": "06/03/2021 13:34:58",
   "LAST_UPDATED_DATE": "06/03/2021 13:34:58",
   "LAST_UPDATED_DAY": "2021-06-03",
   "ORG_ID": 3887701,
   "ORG_NAME": "CHILDREN'S HEALTHCARE OF ATLANTA, INC.",
   "ORG_ADDRESS_1": "CHILDREN'S HEALTHCARE OF ATLANTA",
   "ORG_ADDRESS_2": "1575 Northeast Expressway",
   "ORG_ADDRESS_3": "",
   "ORG_ADDRESS_4": "",
   "ORG_ADDRESS_5": "",
   "CITY": "ATLANTA",
   "STATE": "GA",
   "PHONE_NUMBER": "4047857500",
   "ORG_EMAIL": "sarahmarie.huban@choa.org"
 },
 {
   "USER_ID": "ClarkLLau731",
   "PERSON_ID": 78215070,
   "EMAIL": "ClarkLLau731@cancer.com",
   "NAME_PREFIX": "Dr",
   "FIRST_NAME": "Lauren",
   "MI_NAME": "L",
   "LAST_NAME": "Clark",
   "NAME_SUFFIX": "",
   "STATUS_CODE": 1,
   "STATUS_DESCRIP": "Active",
   "ACCOUNT_CREATED_DATE": "06/09/2021 07:52:10",
   "ACCOUNT_UPDATED_DATE": "06/10/2021 01:23:17",
   "ACCOUNT_LAST_LOGIN_DATE": "06/10/2021 01:20:44",
   "LAST_UPDATED_DATE": "06/10/2021 01:23:17",
   "LAST_UPDATED_DAY": "2021-06-10",
   "ORG_ID": 4343601,
   "ORG_NAME": "SCHNEIDER CHILDREN'S MEDICAL CTR-ISRAEL",
   "ORG_ADDRESS_1": "KAPLAN 14",
   "ORG_ADDRESS_2": "",
   "ORG_ADDRESS_3": "",
   "ORG_ADDRESS_4": "",
   "ORG_ADDRESS_5": "",
   "CITY": "PETACH TIKVA",
   "STATE": "",
   "PHONE_NUMBER": "",
   "ORG_EMAIL": ""
 },
 {
   "USER_ID": "TaylorTTim583",
   "PERSON_ID": 78200806,
   "EMAIL": "TaylorTTim583@cancer.com",
   "NAME_PREFIX": "",
   "FIRST_NAME": "Tim",
   "MI_NAME": "T",
   "LAST_NAME": "Taylor",
   "NAME_SUFFIX": "",
   "STATUS_CODE": 1,
   "STATUS_DESCRIP": "Active",
   "ACCOUNT_CREATED_DATE": "06/03/2021 12:10:51",
   "ACCOUNT_UPDATED_DATE": "",
   "ACCOUNT_LAST_LOGIN_DATE": "",
   "LAST_UPDATED_DATE": "06/03/2021 12:10:51",
   "LAST_UPDATED_DAY": "2021-06-03",
   "ORG_ID": 4374101,
   "ORG_NAME": "MIDWEST VETERANS' BIOMEDICAL RESEARCH FOUNDATION",
   "ORG_ADDRESS_1": "4801 E. LINWOOD BLVD",
   "ORG_ADDRESS_2": "VAMC, BLDG 15, ROOM F1-125",
   "ORG_ADDRESS_3": "",
   "ORG_ADDRESS_4": "",
   "ORG_ADDRESS_5": "",
   "CITY": "KANSAS CITY",
   "STATE": "MO",
   "PHONE_NUMBER": "8169218311",
   "ORG_EMAIL": "cynthia.brewer2@va.gov"
 },
 {
   "USER_ID": "HardacreUUna379",
   "PERSON_ID": 78216386,
   "EMAIL": "HardacreUUna379@cancer.com",
   "NAME_PREFIX": "",
   "FIRST_NAME": "Una",
   "MI_NAME": "U",
   "LAST_NAME": "Hardacre",
   "NAME_SUFFIX": "",
   "STATUS_CODE": 1,
   "STATUS_DESCRIP": "Active",
   "ACCOUNT_CREATED_DATE": "06/09/2021 17:53:09",
   "ACCOUNT_UPDATED_DATE": "",
   "ACCOUNT_LAST_LOGIN_DATE": "",
   "LAST_UPDATED_DATE": "06/09/2021 17:53:09",
   "LAST_UPDATED_DAY": "2021-06-09",
   "ORG_ID": 4374101,
   "ORG_NAME": "MIDWEST VETERANS' BIOMEDICAL RESEARCH FOUNDATION",
   "ORG_ADDRESS_1": "4801 E. LINWOOD BLVD",
   "ORG_ADDRESS_2": "VAMC, BLDG 15, ROOM F1-125",
   "ORG_ADDRESS_3": "",
   "ORG_ADDRESS_4": "",
   "ORG_ADDRESS_5": "",
   "CITY": "KANSAS CITY",
   "STATE": "MO",
   "PHONE_NUMBER": "8169218311",
   "ORG_EMAIL": "cynthia.brewer2@va.gov"
 },
 {
   "USER_ID": "InceEEri548",
   "PERSON_ID": 78220730,
   "EMAIL": "InceEEri548@cancer.com",
   "NAME_PREFIX": "",
   "FIRST_NAME": "Eric",
   "MI_NAME": "E",
   "LAST_NAME": "Ince",
   "NAME_SUFFIX": "",
   "STATUS_CODE": 1,
   "STATUS_DESCRIP": "Active",
   "ACCOUNT_CREATED_DATE": "06/11/2021 16:44:17",
   "ACCOUNT_UPDATED_DATE": "",
   "ACCOUNT_LAST_LOGIN_DATE": "",
   "LAST_UPDATED_DATE": "06/11/2021 16:44:17",
   "LAST_UPDATED_DAY": "2021-06-11",
   "ORG_ID": 4374101,
   "ORG_NAME": "MIDWEST VETERANS' BIOMEDICAL RESEARCH FOUNDATION",
   "ORG_ADDRESS_1": "4801 E. LINWOOD BLVD",
   "ORG_ADDRESS_2": "VAMC, BLDG 15, ROOM F1-125",
   "ORG_ADDRESS_3": "",
   "ORG_ADDRESS_4": "",
   "ORG_ADDRESS_5": "",
   "CITY": "KANSAS CITY",
   "STATE": "MO",
   "PHONE_NUMBER": "8169218311",
   "ORG_EMAIL": "cynthia.brewer2@va.gov"
 },
 {
   "USER_ID": "GibsonAAle150",
   "PERSON_ID": 78196669,
   "EMAIL": "GibsonAAle150@cancer.com",
   "NAME_PREFIX": "",
   "FIRST_NAME": "Alexandra",
   "MI_NAME": "A",
   "LAST_NAME": "Gibson",
   "NAME_SUFFIX": "",
   "STATUS_CODE": 1,
   "STATUS_DESCRIP": "Active",
   "ACCOUNT_CREATED_DATE": "06/01/2021 15:41:05",
   "ACCOUNT_UPDATED_DATE": "06/01/2021 16:17:36",
   "ACCOUNT_LAST_LOGIN_DATE": "06/01/2021 16:17:36",
   "LAST_UPDATED_DATE": "06/01/2021 16:17:36",
   "LAST_UPDATED_DAY": "2021-06-01",
   "ORG_ID": 8551927,
   "ORG_NAME": "USDA, AGRICULTURAL RES SERVICE-MID SOUTH",
   "ORG_ADDRESS_1": "141 EXPERIMENT STATION ROAD",
   "ORG_ADDRESS_2": "",
   "ORG_ADDRESS_3": "",
   "ORG_ADDRESS_4": "",
   "ORG_ADDRESS_5": "",
   "CITY": "STONEVILLE",
   "STATE": "MS",
   "PHONE_NUMBER": "6626865256",
   "ORG_EMAIL": ""
 },
 {
   "USER_ID": "BowerOOli577",
   "PERSON_ID": 78200880,
   "EMAIL": "BowerOOli577@cancer.com",
   "NAME_PREFIX": "Dr",
   "FIRST_NAME": "Olivia",
   "MI_NAME": "O",
   "LAST_NAME": "Bower",
   "NAME_SUFFIX": "",
   "STATUS_CODE": 1,
   "STATUS_DESCRIP": "Active",
   "ACCOUNT_CREATED_DATE": "06/03/2021 12:33:43",
   "ACCOUNT_UPDATED_DATE": "06/15/2021 21:08:17",
   "ACCOUNT_LAST_LOGIN_DATE": "06/15/2021 21:08:17",
   "LAST_UPDATED_DATE": "06/15/2021 21:08:17",
   "LAST_UPDATED_DAY": "2021-06-15",
   "ORG_ID": 4366101,
   "ORG_NAME": "CHROMADEX, INC.",
   "ORG_ADDRESS_1": "10005 MUIRLANDS",
   "ORG_ADDRESS_2": "SUITE G",
   "ORG_ADDRESS_3": "",
   "ORG_ADDRESS_4": "",
   "ORG_ADDRESS_5": "",
   "CITY": "IRVINE",
   "STATE": "CA",
   "PHONE_NUMBER": "9494190288",
   "ORG_EMAIL": "cerp@chromadex.com"
 },
 {
   "USER_ID": "GreeneMMic955",
   "PERSON_ID": 78213677,
   "EMAIL": "GreeneMMic955@cancer.com",
   "NAME_PREFIX": "",
   "FIRST_NAME": "Michelle",
   "MI_NAME": "M",
   "LAST_NAME": "Greene",
   "NAME_SUFFIX": "",
   "STATUS_CODE": 1,
   "STATUS_DESCRIP": "Active",
   "ACCOUNT_CREATED_DATE": "06/08/2021 13:44:13",
   "ACCOUNT_UPDATED_DATE": "",
   "ACCOUNT_LAST_LOGIN_DATE": "",
   "LAST_UPDATED_DATE": "06/08/2021 13:44:13",
   "LAST_UPDATED_DAY": "2021-06-08",
   "ORG_ID": 10046746,
   "ORG_NAME": "RAJIV GANDHI CENTRE FOR BIOTECHNOLOGY",
   "ORG_ADDRESS_1": "RAJIV GANDHI CENTRE FOR BIOTECHNOLOGY",
   "ORG_ADDRESS_2": "THYCAUD POST, POOJAPPURA",
   "ORG_ADDRESS_3": "THIRUVANANTHAPURAM 695014, INDIA",
   "ORG_ADDRESS_4": "",
   "ORG_ADDRESS_5": "",
   "CITY": "THIRUVANANTHAPURAM",
   "STATE": "",
   "PHONE_NUMBER": "",
   "ORG_EMAIL": ""
 },
 {
   "USER_ID": "ShortJJen924",
   "PERSON_ID": 78215510,
   "EMAIL": "ShortJJen924@cancer.com",
   "NAME_PREFIX": "",
   "FIRST_NAME": "Jennifer",
   "MI_NAME": "J",
   "LAST_NAME": "Short",
   "NAME_SUFFIX": "",
   "STATUS_CODE": 1,
   "STATUS_DESCRIP": "Active",
   "ACCOUNT_CREATED_DATE": "06/09/2021 12:28:36",
   "ACCOUNT_UPDATED_DATE": "06/09/2021 13:56:07",
   "ACCOUNT_LAST_LOGIN_DATE": "06/09/2021 13:56:07",
   "LAST_UPDATED_DATE": "06/09/2021 13:56:07",
   "LAST_UPDATED_DAY": "2021-06-09",
   "ORG_ID": 5992614,
   "ORG_NAME": "STATE UNIVERSITY OF NEW YORK AT BUFFALO",
   "ORG_ADDRESS_1": "STATE UNIVERSITY OF NEW YORK AT BUFFALO",
   "ORG_ADDRESS_2": "Sponsored Projects Services, 520 Lee Entrance",
   "ORG_ADDRESS_3": "",
   "ORG_ADDRESS_4": "",
   "ORG_ADDRESS_5": "",
   "CITY": "AMHERST",
   "STATE": "NY",
   "PHONE_NUMBER": "7166452634",
   "ORG_EMAIL": "nih_news@research.buffalo.edu"
 },
 {
   "USER_ID": "LangdonAAva899",
   "PERSON_ID": 78196396,
   "EMAIL": "LangdonAAva899@cancer.com",
   "NAME_PREFIX": "Mr",
   "FIRST_NAME": "Ava",
   "MI_NAME": "A",
   "LAST_NAME": "Langdon",
   "NAME_SUFFIX": "",
   "STATUS_CODE": 1,
   "STATUS_DESCRIP": "Active",
   "ACCOUNT_CREATED_DATE": "06/01/2021 14:11:45",
   "ACCOUNT_UPDATED_DATE": "06/15/2021 12:23:22",
   "ACCOUNT_LAST_LOGIN_DATE": "06/15/2021 12:23:22",
   "LAST_UPDATED_DATE": "06/15/2021 12:23:22",
   "LAST_UPDATED_DAY": "2021-06-15",
   "ORG_ID": 5992614,
   "ORG_NAME": "STATE UNIVERSITY OF NEW YORK AT BUFFALO",
   "ORG_ADDRESS_1": "STATE UNIVERSITY OF NEW YORK AT BUFFALO",
   "ORG_ADDRESS_2": "Sponsored Projects Services, 520 Lee Entrance",
   "ORG_ADDRESS_3": "",
   "ORG_ADDRESS_4": "",
   "ORG_ADDRESS_5": "",
   "CITY": "AMHERST",
   "STATE": "NY",
   "PHONE_NUMBER": "7166452634",
   "ORG_EMAIL": "nih_news@research.buffalo.edu"
 },
 {
   "USER_ID": "MurrayAAli362",
   "PERSON_ID": 78195807,
   "EMAIL": "MurrayAAli362@cancer.com",
   "NAME_PREFIX": "Mr",
   "FIRST_NAME": "Alison",
   "MI_NAME": "A",
   "LAST_NAME": "Murray",
   "NAME_SUFFIX": "",
   "STATUS_CODE": 1,
   "STATUS_DESCRIP": "Active",
   "ACCOUNT_CREATED_DATE": "06/01/2021 11:04:26",
   "ACCOUNT_UPDATED_DATE": "06/01/2021 11:32:40",
   "ACCOUNT_LAST_LOGIN_DATE": "06/01/2021 11:23:47",
   "LAST_UPDATED_DATE": "06/01/2021 11:32:40",
   "LAST_UPDATED_DAY": "2021-06-01",
   "ORG_ID": 5992614,
   "ORG_NAME": "STATE UNIVERSITY OF NEW YORK AT BUFFALO",
   "ORG_ADDRESS_1": "STATE UNIVERSITY OF NEW YORK AT BUFFALO",
   "ORG_ADDRESS_2": "Sponsored Projects Services, 520 Lee Entrance",
   "ORG_ADDRESS_3": "",
   "ORG_ADDRESS_4": "",
   "ORG_ADDRESS_5": "",
   "CITY": "AMHERST",
   "STATE": "NY",
   "PHONE_NUMBER": "7166452634",
   "ORG_EMAIL": "nih_news@research.buffalo.edu"
 },
 {
   "USER_ID": "MillerBBen510",
   "PERSON_ID": 78204137,
   "EMAIL": "MillerBBen510@cancer.com",
   "NAME_PREFIX": "",
   "FIRST_NAME": "Benjamin",
   "MI_NAME": "B",
   "LAST_NAME": "Miller",
   "NAME_SUFFIX": "",
   "STATUS_CODE": 1,
   "STATUS_DESCRIP": "Active",
   "ACCOUNT_CREATED_DATE": "06/04/2021 12:19:03",
   "ACCOUNT_UPDATED_DATE": "06/04/2021 12:27:48",
   "ACCOUNT_LAST_LOGIN_DATE": "06/04/2021 12:27:48",
   "LAST_UPDATED_DATE": "06/04/2021 12:27:48",
   "LAST_UPDATED_DAY": "2021-06-04",
   "ORG_ID": 5992614,
   "ORG_NAME": "STATE UNIVERSITY OF NEW YORK AT BUFFALO",
   "ORG_ADDRESS_1": "STATE UNIVERSITY OF NEW YORK AT BUFFALO",
   "ORG_ADDRESS_2": "Sponsored Projects Services, 520 Lee Entrance",
   "ORG_ADDRESS_3": "",
   "ORG_ADDRESS_4": "",
   "ORG_ADDRESS_5": "",
   "CITY": "AMHERST",
   "STATE": "NY",
   "PHONE_NUMBER": "7166452634",
   "ORG_EMAIL": "nih_news@research.buffalo.edu"
 },
 {
   "USER_ID": "CampbellGGor264",
   "PERSON_ID": 78202155,
   "EMAIL": "CampbellGGor264@cancer.com",
   "NAME_PREFIX": "",
   "FIRST_NAME": "Gordon",
   "MI_NAME": "G",
   "LAST_NAME": "Campbell",
   "NAME_SUFFIX": "",
   "STATUS_CODE": 1,
   "STATUS_DESCRIP": "Active",
   "ACCOUNT_CREATED_DATE": "06/03/2021 17:14:13",
   "ACCOUNT_UPDATED_DATE": "06/03/2021 17:48:36",
   "ACCOUNT_LAST_LOGIN_DATE": "06/03/2021 17:35:44",
   "LAST_UPDATED_DATE": "06/03/2021 17:48:36",
   "LAST_UPDATED_DAY": "2021-06-03",
   "ORG_ID": 5992614,
   "ORG_NAME": "STATE UNIVERSITY OF NEW YORK AT BUFFALO",
   "ORG_ADDRESS_1": "STATE UNIVERSITY OF NEW YORK AT BUFFALO",
   "ORG_ADDRESS_2": "Sponsored Projects Services, 520 Lee Entrance",
   "ORG_ADDRESS_3": "",
   "ORG_ADDRESS_4": "",
   "ORG_ADDRESS_5": "",
   "CITY": "AMHERST",
   "STATE": "NY",
   "PHONE_NUMBER": "7166452634",
   "ORG_EMAIL": "nih_news@research.buffalo.edu"
 },
 {
   "USER_ID": "PatersonJJoh761",
   "PERSON_ID": 78218347,
   "EMAIL": "PatersonJJoh761@cancer.com",
   "NAME_PREFIX": "",
   "FIRST_NAME": "John",
   "MI_NAME": "J",
   "LAST_NAME": "Paterson",
   "NAME_SUFFIX": "",
   "STATUS_CODE": 1,
   "STATUS_DESCRIP": "Active",
   "ACCOUNT_CREATED_DATE": "06/10/2021 16:17:20",
   "ACCOUNT_UPDATED_DATE": "",
   "ACCOUNT_LAST_LOGIN_DATE": "",
   "LAST_UPDATED_DATE": "06/10/2021 16:17:20",
   "LAST_UPDATED_DAY": "2021-06-10",
   "ORG_ID": 5992614,
   "ORG_NAME": "STATE UNIVERSITY OF NEW YORK AT BUFFALO",
   "ORG_ADDRESS_1": "STATE UNIVERSITY OF NEW YORK AT BUFFALO",
   "ORG_ADDRESS_2": "Sponsored Projects Services, 520 Lee Entrance",
   "ORG_ADDRESS_3": "",
   "ORG_ADDRESS_4": "",
   "ORG_ADDRESS_5": "",
   "CITY": "AMHERST",
   "STATE": "NY",
   "PHONE_NUMBER": "7166452634",
   "ORG_EMAIL": "nih_news@research.buffalo.edu"
 },
 {
   "USER_ID": "PaigeGGav572",
   "PERSON_ID": 78218364,
   "EMAIL": "PaigeGGav572@cancer.com",
   "NAME_PREFIX": "",
   "FIRST_NAME": "Gavin",
   "MI_NAME": "G",
   "LAST_NAME": "Paige",
   "NAME_SUFFIX": "",
   "STATUS_CODE": 1,
   "STATUS_DESCRIP": "Active",
   "ACCOUNT_CREATED_DATE": "06/10/2021 16:22:45",
   "ACCOUNT_UPDATED_DATE": "",
   "ACCOUNT_LAST_LOGIN_DATE": "",
   "LAST_UPDATED_DATE": "06/10/2021 16:22:45",
   "LAST_UPDATED_DAY": "2021-06-10",
   "ORG_ID": 5992614,
   "ORG_NAME": "STATE UNIVERSITY OF NEW YORK AT BUFFALO",
   "ORG_ADDRESS_1": "STATE UNIVERSITY OF NEW YORK AT BUFFALO",
   "ORG_ADDRESS_2": "Sponsored Projects Services, 520 Lee Entrance",
   "ORG_ADDRESS_3": "",
   "ORG_ADDRESS_4": "",
   "ORG_ADDRESS_5": "",
   "CITY": "AMHERST",
   "STATE": "NY",
   "PHONE_NUMBER": "7166452634",
   "ORG_EMAIL": "nih_news@research.buffalo.edu"
 },
 {
   "USER_ID": "CampbellAAud684",
   "PERSON_ID": 78215694,
   "EMAIL": "CampbellAAud684@cancer.com",
   "NAME_PREFIX": "Dr",
   "FIRST_NAME": "Audrey",
   "MI_NAME": "A",
   "LAST_NAME": "Campbell",
   "NAME_SUFFIX": "",
   "STATUS_CODE": 1,
   "STATUS_DESCRIP": "Active",
   "ACCOUNT_CREATED_DATE": "06/09/2021 13:51:50",
   "ACCOUNT_UPDATED_DATE": "06/15/2021 12:09:15",
   "ACCOUNT_LAST_LOGIN_DATE": "06/15/2021 12:09:15",
   "LAST_UPDATED_DATE": "06/15/2021 12:09:15",
   "LAST_UPDATED_DAY": "2021-06-15",
   "ORG_ID": 5992614,
   "ORG_NAME": "STATE UNIVERSITY OF NEW YORK AT BUFFALO",
   "ORG_ADDRESS_1": "STATE UNIVERSITY OF NEW YORK AT BUFFALO",
   "ORG_ADDRESS_2": "Sponsored Projects Services, 520 Lee Entrance",
   "ORG_ADDRESS_3": "",
   "ORG_ADDRESS_4": "",
   "ORG_ADDRESS_5": "",
   "CITY": "AMHERST",
   "STATE": "NY",
   "PHONE_NUMBER": "7166452634",
   "ORG_EMAIL": "nih_news@research.buffalo.edu"
 },
 {
   "USER_ID": "ScottCCol191",
   "PERSON_ID": 78196411,
   "EMAIL": "ScottCCol191@cancer.com",
   "NAME_PREFIX": "Ms",
   "FIRST_NAME": "Colin",
   "MI_NAME": "C",
   "LAST_NAME": "Scott",
   "NAME_SUFFIX": "",
   "STATUS_CODE": 1,
   "STATUS_DESCRIP": "Active",
   "ACCOUNT_CREATED_DATE": "06/01/2021 14:15:05",
   "ACCOUNT_UPDATED_DATE": "06/01/2021 15:07:06",
   "ACCOUNT_LAST_LOGIN_DATE": "06/01/2021 15:07:06",
   "LAST_UPDATED_DATE": "06/01/2021 15:07:06",
   "LAST_UPDATED_DAY": "2021-06-01",
   "ORG_ID": 5992614,
   "ORG_NAME": "STATE UNIVERSITY OF NEW YORK AT BUFFALO",
   "ORG_ADDRESS_1": "STATE UNIVERSITY OF NEW YORK AT BUFFALO",
   "ORG_ADDRESS_2": "Sponsored Projects Services, 520 Lee Entrance",
   "ORG_ADDRESS_3": "",
   "ORG_ADDRESS_4": "",
   "ORG_ADDRESS_5": "",
   "CITY": "AMHERST",
   "STATE": "NY",
   "PHONE_NUMBER": "7166452634",
   "ORG_EMAIL": "nih_news@research.buffalo.edu"
 },
 {
   "USER_ID": "AveryDDon940",
   "PERSON_ID": 78217328,
   "EMAIL": "AveryDDon940@cancer.com",
   "NAME_PREFIX": "",
   "FIRST_NAME": "Donna",
   "MI_NAME": "D",
   "LAST_NAME": "Avery",
   "NAME_SUFFIX": "",
   "STATUS_CODE": 4,
   "STATUS_DESCRIP": "Pending Affiliation",
   "ACCOUNT_CREATED_DATE": "06/10/2021 09:33:42",
   "ACCOUNT_UPDATED_DATE": "06/10/2021 17:08:11",
   "ACCOUNT_LAST_LOGIN_DATE": "",
   "LAST_UPDATED_DATE": "06/10/2021 17:08:11",
   "LAST_UPDATED_DAY": "2021-06-10",
   "ORG_ID": 5992614,
   "ORG_NAME": "STATE UNIVERSITY OF NEW YORK AT BUFFALO",
   "ORG_ADDRESS_1": "STATE UNIVERSITY OF NEW YORK AT BUFFALO",
   "ORG_ADDRESS_2": "Sponsored Projects Services, 520 Lee Entrance",
   "ORG_ADDRESS_3": "",
   "ORG_ADDRESS_4": "",
   "ORG_ADDRESS_5": "",
   "CITY": "AMHERST",
   "STATE": "NY",
   "PHONE_NUMBER": "7166452634",
   "ORG_EMAIL": "nih_news@research.buffalo.edu"
 },
 {
   "USER_ID": "KellyEEmm64",
   "PERSON_ID": 78205355,
   "EMAIL": "KellyEEmm64@cancer.com",
   "NAME_PREFIX": "",
   "FIRST_NAME": "Emma",
   "MI_NAME": "E",
   "LAST_NAME": "Kelly",
   "NAME_SUFFIX": "",
   "STATUS_CODE": 1,
   "STATUS_DESCRIP": "Active",
   "ACCOUNT_CREATED_DATE": "06/04/2021 15:15:07",
   "ACCOUNT_UPDATED_DATE": "",
   "ACCOUNT_LAST_LOGIN_DATE": "",
   "LAST_UPDATED_DATE": "06/04/2021 15:15:07",
   "LAST_UPDATED_DAY": "2021-06-04",
   "ORG_ID": 5992614,
   "ORG_NAME": "STATE UNIVERSITY OF NEW YORK AT BUFFALO",
   "ORG_ADDRESS_1": "STATE UNIVERSITY OF NEW YORK AT BUFFALO",
   "ORG_ADDRESS_2": "Sponsored Projects Services, 520 Lee Entrance",
   "ORG_ADDRESS_3": "",
   "ORG_ADDRESS_4": "",
   "ORG_ADDRESS_5": "",
   "CITY": "AMHERST",
   "STATE": "NY",
   "PHONE_NUMBER": "7166452634",
   "ORG_EMAIL": "nih_news@research.buffalo.edu"
 },
 {
   "USER_ID": "TerryVVic868",
   "PERSON_ID": 78196407,
   "EMAIL": "TerryVVic868@cancer.com",
   "NAME_PREFIX": "",
   "FIRST_NAME": "Victoria",
   "MI_NAME": "V",
   "LAST_NAME": "Terry",
   "NAME_SUFFIX": "",
   "STATUS_CODE": 1,
   "STATUS_DESCRIP": "Active",
   "ACCOUNT_CREATED_DATE": "06/01/2021 14:13:52",
   "ACCOUNT_UPDATED_DATE": "06/01/2021 14:47:00",
   "ACCOUNT_LAST_LOGIN_DATE": "06/01/2021 14:32:10",
   "LAST_UPDATED_DATE": "06/01/2021 14:47:00",
   "LAST_UPDATED_DAY": "2021-06-01",
   "ORG_ID": 5992614,
   "ORG_NAME": "STATE UNIVERSITY OF NEW YORK AT BUFFALO",
   "ORG_ADDRESS_1": "STATE UNIVERSITY OF NEW YORK AT BUFFALO",
   "ORG_ADDRESS_2": "Sponsored Projects Services, 520 Lee Entrance",
   "ORG_ADDRESS_3": "",
   "ORG_ADDRESS_4": "",
   "ORG_ADDRESS_5": "",
   "CITY": "AMHERST",
   "STATE": "NY",
   "PHONE_NUMBER": "7166452634",
   "ORG_EMAIL": "nih_news@research.buffalo.edu"
 },
 {
   "USER_ID": "KingAAda661",
   "PERSON_ID": 78208626,
   "EMAIL": "KingAAda661@cancer.com",
   "NAME_PREFIX": "Ms",
   "FIRST_NAME": "Adam",
   "MI_NAME": "A",
   "LAST_NAME": "King",
   "NAME_SUFFIX": "",
   "STATUS_CODE": 1,
   "STATUS_DESCRIP": "Active",
   "ACCOUNT_CREATED_DATE": "06/07/2021 11:31:36",
   "ACCOUNT_UPDATED_DATE": "06/10/2021 14:34:50",
   "ACCOUNT_LAST_LOGIN_DATE": "06/10/2021 14:34:50",
   "LAST_UPDATED_DATE": "06/10/2021 14:34:50",
   "LAST_UPDATED_DAY": "2021-06-10",
   "ORG_ID": 1450402,
   "ORG_NAME": "UNIVERSITY OF MINNESOTA",
   "ORG_ADDRESS_1": "UNIVERSITY OF MINNESOTA TWIN CITIES",
   "ORG_ADDRESS_2": "450 MCNAMARA ALUMNI CENTER",
   "ORG_ADDRESS_3": "",
   "ORG_ADDRESS_4": "",
   "ORG_ADDRESS_5": "",
   "CITY": "MINNEAPOLIS",
   "STATE": "MN",
   "PHONE_NUMBER": "6126245599",
   "ORG_EMAIL": "awards@umn.edu"
 },
 {
   "USER_ID": "HowardDDyl385",
   "PERSON_ID": 78211455,
   "EMAIL": "HowardDDyl385@cancer.com",
   "NAME_PREFIX": "",
   "FIRST_NAME": "Dylan",
   "MI_NAME": "D",
   "LAST_NAME": "Howard",
   "NAME_SUFFIX": "",
   "STATUS_CODE": 1,
   "STATUS_DESCRIP": "Active",
   "ACCOUNT_CREATED_DATE": "06/07/2021 16:35:49",
   "ACCOUNT_UPDATED_DATE": "06/07/2021 16:53:33",
   "ACCOUNT_LAST_LOGIN_DATE": "06/07/2021 16:46:47",
   "LAST_UPDATED_DATE": "06/07/2021 16:53:33",
   "LAST_UPDATED_DAY": "2021-06-07",
   "ORG_ID": 1450402,
   "ORG_NAME": "UNIVERSITY OF MINNESOTA",
   "ORG_ADDRESS_1": "UNIVERSITY OF MINNESOTA TWIN CITIES",
   "ORG_ADDRESS_2": "450 MCNAMARA ALUMNI CENTER",
   "ORG_ADDRESS_3": "",
   "ORG_ADDRESS_4": "",
   "ORG_ADDRESS_5": "",
   "CITY": "MINNEAPOLIS",
   "STATE": "MN",
   "PHONE_NUMBER": "6126245599",
   "ORG_EMAIL": "awards@umn.edu"
 },
 {
   "USER_ID": "MurrayAAda116",
   "PERSON_ID": 78219577,
   "EMAIL": "MurrayAAda116@cancer.com",
   "NAME_PREFIX": "",
   "FIRST_NAME": "Adam",
   "MI_NAME": "A",
   "LAST_NAME": "Murray",
   "NAME_SUFFIX": "",
   "STATUS_CODE": 1,
   "STATUS_DESCRIP": "Active",
   "ACCOUNT_CREATED_DATE": "06/11/2021 09:31:02",
   "ACCOUNT_UPDATED_DATE": "06/12/2021 09:36:55",
   "ACCOUNT_LAST_LOGIN_DATE": "06/12/2021 09:32:00",
   "LAST_UPDATED_DATE": "06/12/2021 09:36:55",
   "LAST_UPDATED_DAY": "2021-06-12",
   "ORG_ID": 1450402,
   "ORG_NAME": "UNIVERSITY OF MINNESOTA",
   "ORG_ADDRESS_1": "UNIVERSITY OF MINNESOTA TWIN CITIES",
   "ORG_ADDRESS_2": "450 MCNAMARA ALUMNI CENTER",
   "ORG_ADDRESS_3": "",
   "ORG_ADDRESS_4": "",
   "ORG_ADDRESS_5": "",
   "CITY": "MINNEAPOLIS",
   "STATE": "MN",
   "PHONE_NUMBER": "6126245599",
   "ORG_EMAIL": "awards@umn.edu"
 },
 {
   "USER_ID": "TuckerDDon760",
   "PERSON_ID": 78207817,
   "EMAIL": "TuckerDDon760@cancer.com",
   "NAME_PREFIX": "",
   "FIRST_NAME": "Donna",
   "MI_NAME": "D",
   "LAST_NAME": "Tucker",
   "NAME_SUFFIX": "",
   "STATUS_CODE": 1,
   "STATUS_DESCRIP": "Active",
   "ACCOUNT_CREATED_DATE": "06/07/2021 09:00:05",
   "ACCOUNT_UPDATED_DATE": "06/10/2021 10:02:15",
   "ACCOUNT_LAST_LOGIN_DATE": "06/10/2021 09:59:28",
   "LAST_UPDATED_DATE": "06/10/2021 10:02:15",
   "LAST_UPDATED_DAY": "2021-06-10",
   "ORG_ID": 1450402,
   "ORG_NAME": "UNIVERSITY OF MINNESOTA",
   "ORG_ADDRESS_1": "UNIVERSITY OF MINNESOTA TWIN CITIES",
   "ORG_ADDRESS_2": "450 MCNAMARA ALUMNI CENTER",
   "ORG_ADDRESS_3": "",
   "ORG_ADDRESS_4": "",
   "ORG_ADDRESS_5": "",
   "CITY": "MINNEAPOLIS",
   "STATE": "MN",
   "PHONE_NUMBER": "6126245599",
   "ORG_EMAIL": "awards@umn.edu"
 },
 {
   "USER_ID": "HowardFFio250",
   "PERSON_ID": 78208511,
   "EMAIL": "HowardFFio250@cancer.com",
   "NAME_PREFIX": "",
   "FIRST_NAME": "Fiona",
   "MI_NAME": "F",
   "LAST_NAME": "Howard",
   "NAME_SUFFIX": "",
   "STATUS_CODE": 1,
   "STATUS_DESCRIP": "Active",
   "ACCOUNT_CREATED_DATE": "06/07/2021 11:16:41",
   "ACCOUNT_UPDATED_DATE": "06/08/2021 19:47:38",
   "ACCOUNT_LAST_LOGIN_DATE": "06/08/2021 19:46:29",
   "LAST_UPDATED_DATE": "06/08/2021 19:47:38",
   "LAST_UPDATED_DAY": "2021-06-08",
   "ORG_ID": 1450402,
   "ORG_NAME": "UNIVERSITY OF MINNESOTA",
   "ORG_ADDRESS_1": "UNIVERSITY OF MINNESOTA TWIN CITIES",
   "ORG_ADDRESS_2": "450 MCNAMARA ALUMNI CENTER",
   "ORG_ADDRESS_3": "",
   "ORG_ADDRESS_4": "",
   "ORG_ADDRESS_5": "",
   "CITY": "MINNEAPOLIS",
   "STATE": "MN",
   "PHONE_NUMBER": "6126245599",
   "ORG_EMAIL": "awards@umn.edu"
 },
 {
   "USER_ID": "ClarkLLil611",
   "PERSON_ID": 78208755,
   "EMAIL": "ClarkLLil611@cancer.com",
   "NAME_PREFIX": "",
   "FIRST_NAME": "Lily",
   "MI_NAME": "L",
   "LAST_NAME": "Clark",
   "NAME_SUFFIX": "",
   "STATUS_CODE": 1,
   "STATUS_DESCRIP": "Active",
   "ACCOUNT_CREATED_DATE": "06/07/2021 11:47:22",
   "ACCOUNT_UPDATED_DATE": "06/15/2021 12:55:04",
   "ACCOUNT_LAST_LOGIN_DATE": "06/15/2021 12:55:04",
   "LAST_UPDATED_DATE": "06/15/2021 12:55:04",
   "LAST_UPDATED_DAY": "2021-06-15",
   "ORG_ID": 1450402,
   "ORG_NAME": "UNIVERSITY OF MINNESOTA",
   "ORG_ADDRESS_1": "UNIVERSITY OF MINNESOTA TWIN CITIES",
   "ORG_ADDRESS_2": "450 MCNAMARA ALUMNI CENTER",
   "ORG_ADDRESS_3": "",
   "ORG_ADDRESS_4": "",
   "ORG_ADDRESS_5": "",
   "CITY": "MINNEAPOLIS",
   "STATE": "MN",
   "PHONE_NUMBER": "6126245599",
   "ORG_EMAIL": "awards@umn.edu"
 },
 {
   "USER_ID": "FergusonLLau807",
   "PERSON_ID": 78209647,
   "EMAIL": "FergusonLLau807@cancer.com",
   "NAME_PREFIX": "",
   "FIRST_NAME": "Lauren",
   "MI_NAME": "L",
   "LAST_NAME": "Ferguson",
   "NAME_SUFFIX": "",
   "STATUS_CODE": 1,
   "STATUS_DESCRIP": "Active",
   "ACCOUNT_CREATED_DATE": "06/07/2021 13:45:48",
   "ACCOUNT_UPDATED_DATE": "06/10/2021 14:52:37",
   "ACCOUNT_LAST_LOGIN_DATE": "06/10/2021 14:52:37",
   "LAST_UPDATED_DATE": "06/10/2021 14:52:37",
   "LAST_UPDATED_DAY": "2021-06-10",
   "ORG_ID": 1450402,
   "ORG_NAME": "UNIVERSITY OF MINNESOTA",
   "ORG_ADDRESS_1": "UNIVERSITY OF MINNESOTA TWIN CITIES",
   "ORG_ADDRESS_2": "450 MCNAMARA ALUMNI CENTER",
   "ORG_ADDRESS_3": "",
   "ORG_ADDRESS_4": "",
   "ORG_ADDRESS_5": "",
   "CITY": "MINNEAPOLIS",
   "STATE": "MN",
   "PHONE_NUMBER": "6126245599",
   "ORG_EMAIL": "awards@umn.edu"
 },
 {
   "USER_ID": "TuckerSSte321",
   "PERSON_ID": 78208711,
   "EMAIL": "TuckerSSte321@cancer.com",
   "NAME_PREFIX": "",
   "FIRST_NAME": "Stephen",
   "MI_NAME": "S",
   "LAST_NAME": "Tucker",
   "NAME_SUFFIX": "",
   "STATUS_CODE": 1,
   "STATUS_DESCRIP": "Active",
   "ACCOUNT_CREATED_DATE": "06/07/2021 11:42:14",
   "ACCOUNT_UPDATED_DATE": "06/08/2021 18:08:08",
   "ACCOUNT_LAST_LOGIN_DATE": "06/08/2021 17:24:13",
   "LAST_UPDATED_DATE": "06/08/2021 18:08:08",
   "LAST_UPDATED_DAY": "2021-06-08",
   "ORG_ID": 1450402,
   "ORG_NAME": "UNIVERSITY OF MINNESOTA",
   "ORG_ADDRESS_1": "UNIVERSITY OF MINNESOTA TWIN CITIES",
   "ORG_ADDRESS_2": "450 MCNAMARA ALUMNI CENTER",
   "ORG_ADDRESS_3": "",
   "ORG_ADDRESS_4": "",
   "ORG_ADDRESS_5": "",
   "CITY": "MINNEAPOLIS",
   "STATE": "MN",
   "PHONE_NUMBER": "6126245599",
   "ORG_EMAIL": "awards@umn.edu"
 },
 {
   "USER_ID": "MorganVVic781",
   "PERSON_ID": 78198259,
   "EMAIL": "MorganVVic781@cancer.com",
   "NAME_PREFIX": "",
   "FIRST_NAME": "Victoria",
   "MI_NAME": "V",
   "LAST_NAME": "Morgan",
   "NAME_SUFFIX": "",
   "STATUS_CODE": 1,
   "STATUS_DESCRIP": "Active",
   "ACCOUNT_CREATED_DATE": "06/02/2021 12:10:55",
   "ACCOUNT_UPDATED_DATE": "06/03/2021 17:08:12",
   "ACCOUNT_LAST_LOGIN_DATE": "06/03/2021 17:08:12",
   "LAST_UPDATED_DATE": "06/03/2021 17:08:12",
   "LAST_UPDATED_DAY": "2021-06-03",
   "ORG_ID": 1450402,
   "ORG_NAME": "UNIVERSITY OF MINNESOTA",
   "ORG_ADDRESS_1": "UNIVERSITY OF MINNESOTA TWIN CITIES",
   "ORG_ADDRESS_2": "450 MCNAMARA ALUMNI CENTER",
   "ORG_ADDRESS_3": "",
   "ORG_ADDRESS_4": "",
   "ORG_ADDRESS_5": "",
   "CITY": "MINNEAPOLIS",
   "STATE": "MN",
   "PHONE_NUMBER": "6126245599",
   "ORG_EMAIL": "awards@umn.edu"
 },
 {
   "USER_ID": "SlaterMMic496",
   "PERSON_ID": 78204955,
   "EMAIL": "SlaterMMic496@cancer.com",
   "NAME_PREFIX": "Ms",
   "FIRST_NAME": "Michelle",
   "MI_NAME": "M",
   "LAST_NAME": "Slater",
   "NAME_SUFFIX": "",
   "STATUS_CODE": 1,
   "STATUS_DESCRIP": "Active",
   "ACCOUNT_CREATED_DATE": "06/04/2021 14:27:19",
   "ACCOUNT_UPDATED_DATE": "06/08/2021 10:50:34",
   "ACCOUNT_LAST_LOGIN_DATE": "06/08/2021 10:46:24",
   "LAST_UPDATED_DATE": "06/08/2021 10:50:34",
   "LAST_UPDATED_DAY": "2021-06-08",
   "ORG_ID": 1450402,
   "ORG_NAME": "UNIVERSITY OF MINNESOTA",
   "ORG_ADDRESS_1": "UNIVERSITY OF MINNESOTA TWIN CITIES",
   "ORG_ADDRESS_2": "450 MCNAMARA ALUMNI CENTER",
   "ORG_ADDRESS_3": "",
   "ORG_ADDRESS_4": "",
   "ORG_ADDRESS_5": "",
   "CITY": "MINNEAPOLIS",
   "STATE": "MN",
   "PHONE_NUMBER": "6126245599",
   "ORG_EMAIL": "awards@umn.edu"
 },
 {
   "USER_ID": "DuncanWWar156",
   "PERSON_ID": 78205301,
   "EMAIL": "DuncanWWar156@cancer.com",
   "NAME_PREFIX": "",
   "FIRST_NAME": "Warren",
   "MI_NAME": "W",
   "LAST_NAME": "Duncan",
   "NAME_SUFFIX": "",
   "STATUS_CODE": 1,
   "STATUS_DESCRIP": "Active",
   "ACCOUNT_CREATED_DATE": "06/04/2021 15:07:46",
   "ACCOUNT_UPDATED_DATE": "06/11/2021 13:30:44",
   "ACCOUNT_LAST_LOGIN_DATE": "06/11/2021 13:30:44",
   "LAST_UPDATED_DATE": "06/11/2021 13:30:44",
   "LAST_UPDATED_DAY": "2021-06-11",
   "ORG_ID": 1450402,
   "ORG_NAME": "UNIVERSITY OF MINNESOTA",
   "ORG_ADDRESS_1": "UNIVERSITY OF MINNESOTA TWIN CITIES",
   "ORG_ADDRESS_2": "450 MCNAMARA ALUMNI CENTER",
   "ORG_ADDRESS_3": "",
   "ORG_ADDRESS_4": "",
   "ORG_ADDRESS_5": "",
   "CITY": "MINNEAPOLIS",
   "STATE": "MN",
   "PHONE_NUMBER": "6126245599",
   "ORG_EMAIL": "awards@umn.edu"
 },
 {
   "USER_ID": "FisherAAda153",
   "PERSON_ID": 78205855,
   "EMAIL": "FisherAAda153@cancer.com",
   "NAME_PREFIX": "",
   "FIRST_NAME": "Adam",
   "MI_NAME": "A",
   "LAST_NAME": "Fisher",
   "NAME_SUFFIX": "",
   "STATUS_CODE": 1,
   "STATUS_DESCRIP": "Active",
   "ACCOUNT_CREATED_DATE": "06/04/2021 16:19:42",
   "ACCOUNT_UPDATED_DATE": "06/15/2021 12:18:06",
   "ACCOUNT_LAST_LOGIN_DATE": "06/15/2021 12:18:06",
   "LAST_UPDATED_DATE": "06/15/2021 12:18:06",
   "LAST_UPDATED_DAY": "2021-06-15",
   "ORG_ID": 1450402,
   "ORG_NAME": "UNIVERSITY OF MINNESOTA",
   "ORG_ADDRESS_1": "UNIVERSITY OF MINNESOTA TWIN CITIES",
   "ORG_ADDRESS_2": "450 MCNAMARA ALUMNI CENTER",
   "ORG_ADDRESS_3": "",
   "ORG_ADDRESS_4": "",
   "ORG_ADDRESS_5": "",
   "CITY": "MINNEAPOLIS",
   "STATE": "MN",
   "PHONE_NUMBER": "6126245599",
   "ORG_EMAIL": "awards@umn.edu"
 },
 {
   "USER_ID": "KellyAAli978",
   "PERSON_ID": 78206281,
   "EMAIL": "KellyAAli978@cancer.com",
   "NAME_PREFIX": "",
   "FIRST_NAME": "Alison",
   "MI_NAME": "A",
   "LAST_NAME": "Kelly",
   "NAME_SUFFIX": "",
   "STATUS_CODE": 1,
   "STATUS_DESCRIP": "Active",
   "ACCOUNT_CREATED_DATE": "06/04/2021 17:17:09",
   "ACCOUNT_UPDATED_DATE": "06/08/2021 19:10:07",
   "ACCOUNT_LAST_LOGIN_DATE": "06/08/2021 19:10:07",
   "LAST_UPDATED_DATE": "06/08/2021 19:10:07",
   "LAST_UPDATED_DAY": "2021-06-08",
   "ORG_ID": 1450402,
   "ORG_NAME": "UNIVERSITY OF MINNESOTA",
   "ORG_ADDRESS_1": "UNIVERSITY OF MINNESOTA TWIN CITIES",
   "ORG_ADDRESS_2": "450 MCNAMARA ALUMNI CENTER",
   "ORG_ADDRESS_3": "",
   "ORG_ADDRESS_4": "",
   "ORG_ADDRESS_5": "",
   "CITY": "MINNEAPOLIS",
   "STATE": "MN",
   "PHONE_NUMBER": "6126245599",
   "ORG_EMAIL": "awards@umn.edu"
 },
 {
   "USER_ID": "FisherTTho75",
   "PERSON_ID": 78204838,
   "EMAIL": "FisherTTho75@cancer.com",
   "NAME_PREFIX": "",
   "FIRST_NAME": "Thomas",
   "MI_NAME": "T",
   "LAST_NAME": "Fisher",
   "NAME_SUFFIX": "",
   "STATUS_CODE": 1,
   "STATUS_DESCRIP": "Active",
   "ACCOUNT_CREATED_DATE": "06/04/2021 14:09:45",
   "ACCOUNT_UPDATED_DATE": "",
   "ACCOUNT_LAST_LOGIN_DATE": "",
   "LAST_UPDATED_DATE": "06/04/2021 14:09:45",
   "LAST_UPDATED_DAY": "2021-06-04",
   "ORG_ID": 1450402,
   "ORG_NAME": "UNIVERSITY OF MINNESOTA",
   "ORG_ADDRESS_1": "UNIVERSITY OF MINNESOTA TWIN CITIES",
   "ORG_ADDRESS_2": "450 MCNAMARA ALUMNI CENTER",
   "ORG_ADDRESS_3": "",
   "ORG_ADDRESS_4": "",
   "ORG_ADDRESS_5": "",
   "CITY": "MINNEAPOLIS",
   "STATE": "MN",
   "PHONE_NUMBER": "6126245599",
   "ORG_EMAIL": "awards@umn.edu"
 },
 {
   "USER_ID": "DuncanLLea187",
   "PERSON_ID": 78205331,
   "EMAIL": "DuncanLLea187@cancer.com",
   "NAME_PREFIX": "",
   "FIRST_NAME": "Leah",
   "MI_NAME": "L",
   "LAST_NAME": "Duncan",
   "NAME_SUFFIX": "",
   "STATUS_CODE": 1,
   "STATUS_DESCRIP": "Active",
   "ACCOUNT_CREATED_DATE": "06/04/2021 15:11:47",
   "ACCOUNT_UPDATED_DATE": "06/10/2021 14:56:53",
   "ACCOUNT_LAST_LOGIN_DATE": "06/10/2021 14:56:53",
   "LAST_UPDATED_DATE": "06/10/2021 14:56:53",
   "LAST_UPDATED_DAY": "2021-06-10",
   "ORG_ID": 1450402,
   "ORG_NAME": "UNIVERSITY OF MINNESOTA",
   "ORG_ADDRESS_1": "UNIVERSITY OF MINNESOTA TWIN CITIES",
   "ORG_ADDRESS_2": "450 MCNAMARA ALUMNI CENTER",
   "ORG_ADDRESS_3": "",
   "ORG_ADDRESS_4": "",
   "ORG_ADDRESS_5": "",
   "CITY": "MINNEAPOLIS",
   "STATE": "MN",
   "PHONE_NUMBER": "6126245599",
   "ORG_EMAIL": "awards@umn.edu"
 },
 {
   "USER_ID": "PayneNNat777",
   "PERSON_ID": 78205899,
   "EMAIL": "PayneNNat777@cancer.com",
   "NAME_PREFIX": "",
   "FIRST_NAME": "Natalie",
   "MI_NAME": "N",
   "LAST_NAME": "Payne",
   "NAME_SUFFIX": "",
   "STATUS_CODE": 1,
   "STATUS_DESCRIP": "Active",
   "ACCOUNT_CREATED_DATE": "06/04/2021 16:24:18",
   "ACCOUNT_UPDATED_DATE": "06/08/2021 10:32:40",
   "ACCOUNT_LAST_LOGIN_DATE": "06/08/2021 10:32:40",
   "LAST_UPDATED_DATE": "06/08/2021 10:32:40",
   "LAST_UPDATED_DAY": "2021-06-08",
   "ORG_ID": 1450402,
   "ORG_NAME": "UNIVERSITY OF MINNESOTA",
   "ORG_ADDRESS_1": "UNIVERSITY OF MINNESOTA TWIN CITIES",
   "ORG_ADDRESS_2": "450 MCNAMARA ALUMNI CENTER",
   "ORG_ADDRESS_3": "",
   "ORG_ADDRESS_4": "",
   "ORG_ADDRESS_5": "",
   "CITY": "MINNEAPOLIS",
   "STATE": "MN",
   "PHONE_NUMBER": "6126245599",
   "ORG_EMAIL": "awards@umn.edu"
 },
 {
   "USER_ID": "PeakeGGor93",
   "PERSON_ID": 78205952,
   "EMAIL": "PeakeGGor93@cancer.com",
   "NAME_PREFIX": "",
   "FIRST_NAME": "Gordon",
   "MI_NAME": "G",
   "LAST_NAME": "Peake",
   "NAME_SUFFIX": "",
   "STATUS_CODE": 1,
   "STATUS_DESCRIP": "Active",
   "ACCOUNT_CREATED_DATE": "06/04/2021 16:34:01",
   "ACCOUNT_UPDATED_DATE": "06/08/2021 10:52:46",
   "ACCOUNT_LAST_LOGIN_DATE": "06/08/2021 10:41:17",
   "LAST_UPDATED_DATE": "06/08/2021 10:52:46",
   "LAST_UPDATED_DAY": "2021-06-08",
   "ORG_ID": 1450402,
   "ORG_NAME": "UNIVERSITY OF MINNESOTA",
   "ORG_ADDRESS_1": "UNIVERSITY OF MINNESOTA TWIN CITIES",
   "ORG_ADDRESS_2": "450 MCNAMARA ALUMNI CENTER",
   "ORG_ADDRESS_3": "",
   "ORG_ADDRESS_4": "",
   "ORG_ADDRESS_5": "",
   "CITY": "MINNEAPOLIS",
   "STATE": "MN",
   "PHONE_NUMBER": "6126245599",
   "ORG_EMAIL": "awards@umn.edu"
 },
 {
   "USER_ID": "DyerCCon662",
   "PERSON_ID": 78197814,
   "EMAIL": "DyerCCon662@cancer.com",
   "NAME_PREFIX": "",
   "FIRST_NAME": "Connor",
   "MI_NAME": "C",
   "LAST_NAME": "Dyer",
   "NAME_SUFFIX": "",
   "STATUS_CODE": 1,
   "STATUS_DESCRIP": "Active",
   "ACCOUNT_CREATED_DATE": "06/02/2021 09:34:07",
   "ACCOUNT_UPDATED_DATE": "06/15/2021 15:07:33",
   "ACCOUNT_LAST_LOGIN_DATE": "06/15/2021 15:03:17",
   "LAST_UPDATED_DATE": "06/15/2021 15:07:33",
   "LAST_UPDATED_DAY": "2021-06-15",
   "ORG_ID": 1450402,
   "ORG_NAME": "UNIVERSITY OF MINNESOTA",
   "ORG_ADDRESS_1": "UNIVERSITY OF MINNESOTA TWIN CITIES",
   "ORG_ADDRESS_2": "450 MCNAMARA ALUMNI CENTER",
   "ORG_ADDRESS_3": "",
   "ORG_ADDRESS_4": "",
   "ORG_ADDRESS_5": "",
   "CITY": "MINNEAPOLIS",
   "STATE": "MN",
   "PHONE_NUMBER": "6126245599",
   "ORG_EMAIL": "awards@umn.edu"
 },
 {
   "USER_ID": "FergusonPPip838",
   "PERSON_ID": 78212939,
   "EMAIL": "FergusonPPip838@cancer.com",
   "NAME_PREFIX": "",
   "FIRST_NAME": "Pippa",
   "MI_NAME": "P",
   "LAST_NAME": "Ferguson",
   "NAME_SUFFIX": "",
   "STATUS_CODE": 1,
   "STATUS_DESCRIP": "Active",
   "ACCOUNT_CREATED_DATE": "06/08/2021 08:47:10",
   "ACCOUNT_UPDATED_DATE": "06/08/2021 20:18:39",
   "ACCOUNT_LAST_LOGIN_DATE": "06/08/2021 20:11:51",
   "LAST_UPDATED_DATE": "06/08/2021 20:18:39",
   "LAST_UPDATED_DAY": "2021-06-08",
   "ORG_ID": 1450402,
   "ORG_NAME": "UNIVERSITY OF MINNESOTA",
   "ORG_ADDRESS_1": "UNIVERSITY OF MINNESOTA TWIN CITIES",
   "ORG_ADDRESS_2": "450 MCNAMARA ALUMNI CENTER",
   "ORG_ADDRESS_3": "",
   "ORG_ADDRESS_4": "",
   "ORG_ADDRESS_5": "",
   "CITY": "MINNEAPOLIS",
   "STATE": "MN",
   "PHONE_NUMBER": "6126245599",
   "ORG_EMAIL": "awards@umn.edu"
 },
 {
   "USER_ID": "TerryPPhi538",
   "PERSON_ID": 78200053,
   "EMAIL": "TerryPPhi538@cancer.com",
   "NAME_PREFIX": "Mr",
   "FIRST_NAME": "Phil",
   "MI_NAME": "P",
   "LAST_NAME": "Terry",
   "NAME_SUFFIX": "",
   "STATUS_CODE": 1,
   "STATUS_DESCRIP": "Active",
   "ACCOUNT_CREATED_DATE": "06/03/2021 07:53:00",
   "ACCOUNT_UPDATED_DATE": "06/03/2021 16:13:32",
   "ACCOUNT_LAST_LOGIN_DATE": "06/03/2021 16:13:32",
   "LAST_UPDATED_DATE": "06/03/2021 16:13:32",
   "LAST_UPDATED_DAY": "2021-06-03",
   "ORG_ID": 1450402,
   "ORG_NAME": "UNIVERSITY OF MINNESOTA",
   "ORG_ADDRESS_1": "UNIVERSITY OF MINNESOTA TWIN CITIES",
   "ORG_ADDRESS_2": "450 MCNAMARA ALUMNI CENTER",
   "ORG_ADDRESS_3": "",
   "ORG_ADDRESS_4": "",
   "ORG_ADDRESS_5": "",
   "CITY": "MINNEAPOLIS",
   "STATE": "MN",
   "PHONE_NUMBER": "6126245599",
   "ORG_EMAIL": "awards@umn.edu"
 },
 {
   "USER_ID": "BrownCCar350",
   "PERSON_ID": 78200224,
   "EMAIL": "BrownCCar350@cancer.com",
   "NAME_PREFIX": "",
   "FIRST_NAME": "Carol",
   "MI_NAME": "C",
   "LAST_NAME": "Brown",
   "NAME_SUFFIX": "",
   "STATUS_CODE": 1,
   "STATUS_DESCRIP": "Active",
   "ACCOUNT_CREATED_DATE": "06/03/2021 09:32:26",
   "ACCOUNT_UPDATED_DATE": "06/03/2021 10:46:24",
   "ACCOUNT_LAST_LOGIN_DATE": "06/03/2021 10:40:36",
   "LAST_UPDATED_DATE": "06/03/2021 10:46:24",
   "LAST_UPDATED_DAY": "2021-06-03",
   "ORG_ID": 1450402,
   "ORG_NAME": "UNIVERSITY OF MINNESOTA",
   "ORG_ADDRESS_1": "UNIVERSITY OF MINNESOTA TWIN CITIES",
   "ORG_ADDRESS_2": "450 MCNAMARA ALUMNI CENTER",
   "ORG_ADDRESS_3": "",
   "ORG_ADDRESS_4": "",
   "ORG_ADDRESS_5": "",
   "CITY": "MINNEAPOLIS",
   "STATE": "MN",
   "PHONE_NUMBER": "6126245599",
   "ORG_EMAIL": "awards@umn.edu"
 },
 {
   "USER_ID": "AbrahamSSam104",
   "PERSON_ID": 78217527,
   "EMAIL": "AbrahamSSam104@cancer.com",
   "NAME_PREFIX": "",
   "FIRST_NAME": "Samantha",
   "MI_NAME": "S",
   "LAST_NAME": "Abraham",
   "NAME_SUFFIX": "",
   "STATUS_CODE": 1,
   "STATUS_DESCRIP": "Active",
   "ACCOUNT_CREATED_DATE": "06/10/2021 11:10:37",
   "ACCOUNT_UPDATED_DATE": "06/15/2021 10:10:23",
   "ACCOUNT_LAST_LOGIN_DATE": "06/15/2021 10:10:23",
   "LAST_UPDATED_DATE": "06/15/2021 10:10:23",
   "LAST_UPDATED_DAY": "2021-06-15",
   "ORG_ID": 1450402,
   "ORG_NAME": "UNIVERSITY OF MINNESOTA",
   "ORG_ADDRESS_1": "UNIVERSITY OF MINNESOTA TWIN CITIES",
   "ORG_ADDRESS_2": "450 MCNAMARA ALUMNI CENTER",
   "ORG_ADDRESS_3": "",
   "ORG_ADDRESS_4": "",
   "ORG_ADDRESS_5": "",
   "CITY": "MINNEAPOLIS",
   "STATE": "MN",
   "PHONE_NUMBER": "6126245599",
   "ORG_EMAIL": "awards@umn.edu"
 },
 {
   "USER_ID": "CarrLLia512",
   "PERSON_ID": 78203299,
   "EMAIL": "CarrLLia512@cancer.com",
   "NAME_PREFIX": "Mr",
   "FIRST_NAME": "Liam",
   "MI_NAME": "L",
   "LAST_NAME": "Carr",
   "NAME_SUFFIX": "",
   "STATUS_CODE": 1,
   "STATUS_DESCRIP": "Active",
   "ACCOUNT_CREATED_DATE": "06/04/2021 09:12:40",
   "ACCOUNT_UPDATED_DATE": "06/15/2021 17:45:42",
   "ACCOUNT_LAST_LOGIN_DATE": "06/15/2021 17:45:42",
   "LAST_UPDATED_DATE": "06/15/2021 17:45:42",
   "LAST_UPDATED_DAY": "2021-06-15",
   "ORG_ID": 1450402,
   "ORG_NAME": "UNIVERSITY OF MINNESOTA",
   "ORG_ADDRESS_1": "UNIVERSITY OF MINNESOTA TWIN CITIES",
   "ORG_ADDRESS_2": "450 MCNAMARA ALUMNI CENTER",
   "ORG_ADDRESS_3": "",
   "ORG_ADDRESS_4": "",
   "ORG_ADDRESS_5": "",
   "CITY": "MINNEAPOLIS",
   "STATE": "MN",
   "PHONE_NUMBER": "6126245599",
   "ORG_EMAIL": "awards@umn.edu"
 },
 {
   "USER_ID": "GreeneCCar430",
   "PERSON_ID": 78204402,
   "EMAIL": "GreeneCCar430@cancer.com",
   "NAME_PREFIX": "",
   "FIRST_NAME": "Carol",
   "MI_NAME": "C",
   "LAST_NAME": "Greene",
   "NAME_SUFFIX": "",
   "STATUS_CODE": 1,
   "STATUS_DESCRIP": "Active",
   "ACCOUNT_CREATED_DATE": "06/04/2021 13:04:35",
   "ACCOUNT_UPDATED_DATE": "06/08/2021 10:54:38",
   "ACCOUNT_LAST_LOGIN_DATE": "06/08/2021 10:53:19",
   "LAST_UPDATED_DATE": "06/08/2021 10:54:38",
   "LAST_UPDATED_DAY": "2021-06-08",
   "ORG_ID": 1450402,
   "ORG_NAME": "UNIVERSITY OF MINNESOTA",
   "ORG_ADDRESS_1": "UNIVERSITY OF MINNESOTA TWIN CITIES",
   "ORG_ADDRESS_2": "450 MCNAMARA ALUMNI CENTER",
   "ORG_ADDRESS_3": "",
   "ORG_ADDRESS_4": "",
   "ORG_ADDRESS_5": "",
   "CITY": "MINNEAPOLIS",
   "STATE": "MN",
   "PHONE_NUMBER": "6126245599",
   "ORG_EMAIL": "awards@umn.edu"
 },
 {
   "USER_ID": "WelchMMel408",
   "PERSON_ID": 78204455,
   "EMAIL": "WelchMMel408@cancer.com",
   "NAME_PREFIX": "",
   "FIRST_NAME": "Melanie",
   "MI_NAME": "M",
   "LAST_NAME": "Welch",
   "NAME_SUFFIX": "",
   "STATUS_CODE": 1,
   "STATUS_DESCRIP": "Active",
   "ACCOUNT_CREATED_DATE": "06/04/2021 13:18:11",
   "ACCOUNT_UPDATED_DATE": "06/15/2021 17:19:32",
   "ACCOUNT_LAST_LOGIN_DATE": "06/15/2021 17:19:32",
   "LAST_UPDATED_DATE": "06/15/2021 17:19:32",
   "LAST_UPDATED_DAY": "2021-06-15",
   "ORG_ID": 1450402,
   "ORG_NAME": "UNIVERSITY OF MINNESOTA",
   "ORG_ADDRESS_1": "UNIVERSITY OF MINNESOTA TWIN CITIES",
   "ORG_ADDRESS_2": "450 MCNAMARA ALUMNI CENTER",
   "ORG_ADDRESS_3": "",
   "ORG_ADDRESS_4": "",
   "ORG_ADDRESS_5": "",
   "CITY": "MINNEAPOLIS",
   "STATE": "MN",
   "PHONE_NUMBER": "6126245599",
   "ORG_EMAIL": "awards@umn.edu"
 },
 {
   "USER_ID": "ScottVVic618",
   "PERSON_ID": 78208036,
   "EMAIL": "ScottVVic618@cancer.com",
   "NAME_PREFIX": "",
   "FIRST_NAME": "Victoria",
   "MI_NAME": "V",
   "LAST_NAME": "Scott",
   "NAME_SUFFIX": "",
   "STATUS_CODE": 1,
   "STATUS_DESCRIP": "Active",
   "ACCOUNT_CREATED_DATE": "06/07/2021 09:53:12",
   "ACCOUNT_UPDATED_DATE": "06/15/2021 13:06:27",
   "ACCOUNT_LAST_LOGIN_DATE": "06/15/2021 13:06:27",
   "LAST_UPDATED_DATE": "06/15/2021 13:06:27",
   "LAST_UPDATED_DAY": "2021-06-15",
   "ORG_ID": 1450402,
   "ORG_NAME": "UNIVERSITY OF MINNESOTA",
   "ORG_ADDRESS_1": "UNIVERSITY OF MINNESOTA TWIN CITIES",
   "ORG_ADDRESS_2": "450 MCNAMARA ALUMNI CENTER",
   "ORG_ADDRESS_3": "",
   "ORG_ADDRESS_4": "",
   "ORG_ADDRESS_5": "",
   "CITY": "MINNEAPOLIS",
   "STATE": "MN",
   "PHONE_NUMBER": "6126245599",
   "ORG_EMAIL": "awards@umn.edu"
 },
 {
   "USER_ID": "ColemanAAnn161",
   "PERSON_ID": 78208305,
   "EMAIL": "ColemanAAnn161@cancer.com",
   "NAME_PREFIX": "Dr",
   "FIRST_NAME": "Anne",
   "MI_NAME": "A",
   "LAST_NAME": "Coleman",
   "NAME_SUFFIX": "",
   "STATUS_CODE": 1,
   "STATUS_DESCRIP": "Active",
   "ACCOUNT_CREATED_DATE": "06/07/2021 10:43:04",
   "ACCOUNT_UPDATED_DATE": "06/15/2021 12:14:36",
   "ACCOUNT_LAST_LOGIN_DATE": "06/15/2021 12:14:36",
   "LAST_UPDATED_DATE": "06/15/2021 12:14:36",
   "LAST_UPDATED_DAY": "2021-06-15",
   "ORG_ID": 1450402,
   "ORG_NAME": "UNIVERSITY OF MINNESOTA",
   "ORG_ADDRESS_1": "UNIVERSITY OF MINNESOTA TWIN CITIES",
   "ORG_ADDRESS_2": "450 MCNAMARA ALUMNI CENTER",
   "ORG_ADDRESS_3": "",
   "ORG_ADDRESS_4": "",
   "ORG_ADDRESS_5": "",
   "CITY": "MINNEAPOLIS",
   "STATE": "MN",
   "PHONE_NUMBER": "6126245599",
   "ORG_EMAIL": "awards@umn.edu"
 },
 {
   "USER_ID": "RutherfordSSam309",
   "PERSON_ID": 78208909,
   "EMAIL": "RutherfordSSam309@cancer.com",
   "NAME_PREFIX": "",
   "FIRST_NAME": "Sam",
   "MI_NAME": "S",
   "LAST_NAME": "Rutherford",
   "NAME_SUFFIX": "",
   "STATUS_CODE": 1,
   "STATUS_DESCRIP": "Active",
   "ACCOUNT_CREATED_DATE": "06/07/2021 12:04:40",
   "ACCOUNT_UPDATED_DATE": "06/08/2021 10:36:48",
   "ACCOUNT_LAST_LOGIN_DATE": "06/08/2021 10:36:48",
   "LAST_UPDATED_DATE": "06/08/2021 10:36:48",
   "LAST_UPDATED_DAY": "2021-06-08",
   "ORG_ID": 1450402,
   "ORG_NAME": "UNIVERSITY OF MINNESOTA",
   "ORG_ADDRESS_1": "UNIVERSITY OF MINNESOTA TWIN CITIES",
   "ORG_ADDRESS_2": "450 MCNAMARA ALUMNI CENTER",
   "ORG_ADDRESS_3": "",
   "ORG_ADDRESS_4": "",
   "ORG_ADDRESS_5": "",
   "CITY": "MINNEAPOLIS",
   "STATE": "MN",
   "PHONE_NUMBER": "6126245599",
   "ORG_EMAIL": "awards@umn.edu"
 },
 {
   "USER_ID": "VaughanAAmy332",
   "PERSON_ID": 78209856,
   "EMAIL": "VaughanAAmy332@cancer.com",
   "NAME_PREFIX": "",
   "FIRST_NAME": "Amy",
   "MI_NAME": "A",
   "LAST_NAME": "Vaughan",
   "NAME_SUFFIX": "",
   "STATUS_CODE": 1,
   "STATUS_DESCRIP": "Active",
   "ACCOUNT_CREATED_DATE": "06/07/2021 14:07:12",
   "ACCOUNT_UPDATED_DATE": "06/10/2021 17:15:32",
   "ACCOUNT_LAST_LOGIN_DATE": "06/10/2021 17:15:32",
   "LAST_UPDATED_DATE": "06/10/2021 17:15:32",
   "LAST_UPDATED_DAY": "2021-06-10",
   "ORG_ID": 1450402,
   "ORG_NAME": "UNIVERSITY OF MINNESOTA",
   "ORG_ADDRESS_1": "UNIVERSITY OF MINNESOTA TWIN CITIES",
   "ORG_ADDRESS_2": "450 MCNAMARA ALUMNI CENTER",
   "ORG_ADDRESS_3": "",
   "ORG_ADDRESS_4": "",
   "ORG_ADDRESS_5": "",
   "CITY": "MINNEAPOLIS",
   "STATE": "MN",
   "PHONE_NUMBER": "6126245599",
   "ORG_EMAIL": "awards@umn.edu"
 },
 {
   "USER_ID": "BowerCCha279",
   "PERSON_ID": 78209944,
   "EMAIL": "BowerCCha279@cancer.com",
   "NAME_PREFIX": "Mr",
   "FIRST_NAME": "Charles",
   "MI_NAME": "C",
   "LAST_NAME": "Bower",
   "NAME_SUFFIX": "",
   "STATUS_CODE": 1,
   "STATUS_DESCRIP": "Active",
   "ACCOUNT_CREATED_DATE": "06/07/2021 14:15:06",
   "ACCOUNT_UPDATED_DATE": "06/08/2021 09:31:50",
   "ACCOUNT_LAST_LOGIN_DATE": "06/08/2021 09:29:45",
   "LAST_UPDATED_DATE": "06/08/2021 09:31:50",
   "LAST_UPDATED_DAY": "2021-06-08",
   "ORG_ID": 1450402,
   "ORG_NAME": "UNIVERSITY OF MINNESOTA",
   "ORG_ADDRESS_1": "UNIVERSITY OF MINNESOTA TWIN CITIES",
   "ORG_ADDRESS_2": "450 MCNAMARA ALUMNI CENTER",
   "ORG_ADDRESS_3": "",
   "ORG_ADDRESS_4": "",
   "ORG_ADDRESS_5": "",
   "CITY": "MINNEAPOLIS",
   "STATE": "MN",
   "PHONE_NUMBER": "6126245599",
   "ORG_EMAIL": "awards@umn.edu"
 },
 {
   "USER_ID": "OgdenYYvo807",
   "PERSON_ID": 78211163,
   "EMAIL": "OgdenYYvo807@cancer.com",
   "NAME_PREFIX": "",
   "FIRST_NAME": "Yvonne",
   "MI_NAME": "Y",
   "LAST_NAME": "Ogden",
   "NAME_SUFFIX": "",
   "STATUS_CODE": 1,
   "STATUS_DESCRIP": "Active",
   "ACCOUNT_CREATED_DATE": "06/07/2021 16:11:25",
   "ACCOUNT_UPDATED_DATE": "06/08/2021 12:24:35",
   "ACCOUNT_LAST_LOGIN_DATE": "06/08/2021 12:24:35",
   "LAST_UPDATED_DATE": "06/08/2021 12:24:35",
   "LAST_UPDATED_DAY": "2021-06-08",
   "ORG_ID": 1450402,
   "ORG_NAME": "UNIVERSITY OF MINNESOTA",
   "ORG_ADDRESS_1": "UNIVERSITY OF MINNESOTA TWIN CITIES",
   "ORG_ADDRESS_2": "450 MCNAMARA ALUMNI CENTER",
   "ORG_ADDRESS_3": "",
   "ORG_ADDRESS_4": "",
   "ORG_ADDRESS_5": "",
   "CITY": "MINNEAPOLIS",
   "STATE": "MN",
   "PHONE_NUMBER": "6126245599",
   "ORG_EMAIL": "awards@umn.edu"
 },
 {
   "USER_ID": "HillCCon988",
   "PERSON_ID": 78195826,
   "EMAIL": "HillCCon988@cancer.com",
   "NAME_PREFIX": "",
   "FIRST_NAME": "Connor",
   "MI_NAME": "C",
   "LAST_NAME": "Hill",
   "NAME_SUFFIX": "",
   "STATUS_CODE": 1,
   "STATUS_DESCRIP": "Active",
   "ACCOUNT_CREATED_DATE": "06/01/2021 11:09:42",
   "ACCOUNT_UPDATED_DATE": "06/01/2021 11:19:09",
   "ACCOUNT_LAST_LOGIN_DATE": "06/01/2021 11:19:09",
   "LAST_UPDATED_DATE": "06/01/2021 11:19:09",
   "LAST_UPDATED_DAY": "2021-06-01",
   "ORG_ID": 1450402,
   "ORG_NAME": "UNIVERSITY OF MINNESOTA",
   "ORG_ADDRESS_1": "UNIVERSITY OF MINNESOTA TWIN CITIES",
   "ORG_ADDRESS_2": "450 MCNAMARA ALUMNI CENTER",
   "ORG_ADDRESS_3": "",
   "ORG_ADDRESS_4": "",
   "ORG_ADDRESS_5": "",
   "CITY": "MINNEAPOLIS",
   "STATE": "MN",
   "PHONE_NUMBER": "6126245599",
   "ORG_EMAIL": "awards@umn.edu"
 },
 {
   "USER_ID": "RobertsonCCon131",
   "PERSON_ID": 78219454,
   "EMAIL": "RobertsonCCon131@cancer.com",
   "NAME_PREFIX": "",
   "FIRST_NAME": "Connor",
   "MI_NAME": "C",
   "LAST_NAME": "Robertson",
   "NAME_SUFFIX": "",
   "STATUS_CODE": 1,
   "STATUS_DESCRIP": "Active",
   "ACCOUNT_CREATED_DATE": "06/11/2021 08:24:34",
   "ACCOUNT_UPDATED_DATE": "06/11/2021 09:40:26",
   "ACCOUNT_LAST_LOGIN_DATE": "06/11/2021 09:37:00",
   "LAST_UPDATED_DATE": "06/11/2021 09:40:26",
   "LAST_UPDATED_DAY": "2021-06-11",
   "ORG_ID": 1450402,
   "ORG_NAME": "UNIVERSITY OF MINNESOTA",
   "ORG_ADDRESS_1": "UNIVERSITY OF MINNESOTA TWIN CITIES",
   "ORG_ADDRESS_2": "450 MCNAMARA ALUMNI CENTER",
   "ORG_ADDRESS_3": "",
   "ORG_ADDRESS_4": "",
   "ORG_ADDRESS_5": "",
   "CITY": "MINNEAPOLIS",
   "STATE": "MN",
   "PHONE_NUMBER": "6126245599",
   "ORG_EMAIL": "awards@umn.edu"
 },
 {
   "USER_ID": "AllanAAnt730",
   "PERSON_ID": 78219446,
   "EMAIL": "AllanAAnt730@cancer.com",
   "NAME_PREFIX": "Dr",
   "FIRST_NAME": "Anthony",
   "MI_NAME": "A",
   "LAST_NAME": "Allan",
   "NAME_SUFFIX": "",
   "STATUS_CODE": 1,
   "STATUS_DESCRIP": "Active",
   "ACCOUNT_CREATED_DATE": "06/11/2021 08:14:27",
   "ACCOUNT_UPDATED_DATE": "06/11/2021 11:17:46",
   "ACCOUNT_LAST_LOGIN_DATE": "06/11/2021 11:17:46",
   "LAST_UPDATED_DATE": "06/11/2021 11:17:46",
   "LAST_UPDATED_DAY": "2021-06-11",
   "ORG_ID": 1450402,
   "ORG_NAME": "UNIVERSITY OF MINNESOTA",
   "ORG_ADDRESS_1": "UNIVERSITY OF MINNESOTA TWIN CITIES",
   "ORG_ADDRESS_2": "450 MCNAMARA ALUMNI CENTER",
   "ORG_ADDRESS_3": "",
   "ORG_ADDRESS_4": "",
   "ORG_ADDRESS_5": "",
   "CITY": "MINNEAPOLIS",
   "STATE": "MN",
   "PHONE_NUMBER": "6126245599",
   "ORG_EMAIL": "awards@umn.edu"
 },
 {
   "USER_ID": "TaylorZZoe185",
   "PERSON_ID": 78212894,
   "EMAIL": "TaylorZZoe185@cancer.com",
   "NAME_PREFIX": "",
   "FIRST_NAME": "Zoe",
   "MI_NAME": "Z",
   "LAST_NAME": "Taylor",
   "NAME_SUFFIX": "",
   "STATUS_CODE": 1,
   "STATUS_DESCRIP": "Active",
   "ACCOUNT_CREATED_DATE": "06/08/2021 07:45:35",
   "ACCOUNT_UPDATED_DATE": "06/08/2021 14:50:32",
   "ACCOUNT_LAST_LOGIN_DATE": "06/08/2021 14:46:40",
   "LAST_UPDATED_DATE": "06/08/2021 14:50:32",
   "LAST_UPDATED_DAY": "2021-06-08",
   "ORG_ID": 1450402,
   "ORG_NAME": "UNIVERSITY OF MINNESOTA",
   "ORG_ADDRESS_1": "UNIVERSITY OF MINNESOTA TWIN CITIES",
   "ORG_ADDRESS_2": "450 MCNAMARA ALUMNI CENTER",
   "ORG_ADDRESS_3": "",
   "ORG_ADDRESS_4": "",
   "ORG_ADDRESS_5": "",
   "CITY": "MINNEAPOLIS",
   "STATE": "MN",
   "PHONE_NUMBER": "6126245599",
   "ORG_EMAIL": "awards@umn.edu"
 },
 {
   "USER_ID": "FraserVVan175",
   "PERSON_ID": 78223270,
   "EMAIL": "FraserVVan175@cancer.com",
   "NAME_PREFIX": "",
   "FIRST_NAME": "Vanessa",
   "MI_NAME": "V",
   "LAST_NAME": "Fraser",
   "NAME_SUFFIX": "",
   "STATUS_CODE": 1,
   "STATUS_DESCRIP": "Active",
   "ACCOUNT_CREATED_DATE": "06/14/2021 15:28:33",
   "ACCOUNT_UPDATED_DATE": "06/14/2021 17:12:54",
   "ACCOUNT_LAST_LOGIN_DATE": "06/14/2021 17:12:54",
   "LAST_UPDATED_DATE": "06/14/2021 17:12:54",
   "LAST_UPDATED_DAY": "2021-06-14",
   "ORG_ID": 1450402,
   "ORG_NAME": "UNIVERSITY OF MINNESOTA",
   "ORG_ADDRESS_1": "UNIVERSITY OF MINNESOTA TWIN CITIES",
   "ORG_ADDRESS_2": "450 MCNAMARA ALUMNI CENTER",
   "ORG_ADDRESS_3": "",
   "ORG_ADDRESS_4": "",
   "ORG_ADDRESS_5": "",
   "CITY": "MINNEAPOLIS",
   "STATE": "MN",
   "PHONE_NUMBER": "6126245599",
   "ORG_EMAIL": "awards@umn.edu"
 },
 {
   "USER_ID": "LambertKKim990",
   "PERSON_ID": 78222279,
   "EMAIL": "LambertKKim990@cancer.com",
   "NAME_PREFIX": "",
   "FIRST_NAME": "Kimberly",
   "MI_NAME": "K",
   "LAST_NAME": "Lambert",
   "NAME_SUFFIX": "",
   "STATUS_CODE": 1,
   "STATUS_DESCRIP": "Active",
   "ACCOUNT_CREATED_DATE": "06/14/2021 11:37:23",
   "ACCOUNT_UPDATED_DATE": "06/14/2021 12:30:33",
   "ACCOUNT_LAST_LOGIN_DATE": "06/14/2021 11:52:29",
   "LAST_UPDATED_DATE": "06/14/2021 12:30:33",
   "LAST_UPDATED_DAY": "2021-06-14",
   "ORG_ID": 1450402,
   "ORG_NAME": "UNIVERSITY OF MINNESOTA",
   "ORG_ADDRESS_1": "UNIVERSITY OF MINNESOTA TWIN CITIES",
   "ORG_ADDRESS_2": "450 MCNAMARA ALUMNI CENTER",
   "ORG_ADDRESS_3": "",
   "ORG_ADDRESS_4": "",
   "ORG_ADDRESS_5": "",
   "CITY": "MINNEAPOLIS",
   "STATE": "MN",
   "PHONE_NUMBER": "6126245599",
   "ORG_EMAIL": "awards@umn.edu"
 },
 {
   "USER_ID": "CameronPPet528",
   "PERSON_ID": 78217505,
   "EMAIL": "CameronPPet528@cancer.com",
   "NAME_PREFIX": "",
   "FIRST_NAME": "Peter",
   "MI_NAME": "P",
   "LAST_NAME": "Cameron",
   "NAME_SUFFIX": "",
   "STATUS_CODE": 1,
   "STATUS_DESCRIP": "Active",
   "ACCOUNT_CREATED_DATE": "06/10/2021 10:57:54",
   "ACCOUNT_UPDATED_DATE": "06/14/2021 15:29:03",
   "ACCOUNT_LAST_LOGIN_DATE": "06/14/2021 15:29:03",
   "LAST_UPDATED_DATE": "06/14/2021 15:29:03",
   "LAST_UPDATED_DAY": "2021-06-14",
   "ORG_ID": 1450402,
   "ORG_NAME": "UNIVERSITY OF MINNESOTA",
   "ORG_ADDRESS_1": "UNIVERSITY OF MINNESOTA TWIN CITIES",
   "ORG_ADDRESS_2": "450 MCNAMARA ALUMNI CENTER",
   "ORG_ADDRESS_3": "",
   "ORG_ADDRESS_4": "",
   "ORG_ADDRESS_5": "",
   "CITY": "MINNEAPOLIS",
   "STATE": "MN",
   "PHONE_NUMBER": "6126245599",
   "ORG_EMAIL": "awards@umn.edu"
 },
 {
   "USER_ID": "HarrisJJac117",
   "PERSON_ID": 78215050,
   "EMAIL": "HarrisJJac117@cancer.com",
   "NAME_PREFIX": "",
   "FIRST_NAME": "Jacob",
   "MI_NAME": "J",
   "LAST_NAME": "Harris",
   "NAME_SUFFIX": "",
   "STATUS_CODE": 1,
   "STATUS_DESCRIP": "Active",
   "ACCOUNT_CREATED_DATE": "06/09/2021 06:47:00",
   "ACCOUNT_UPDATED_DATE": "06/15/2021 13:00:08",
   "ACCOUNT_LAST_LOGIN_DATE": "06/15/2021 13:00:08",
   "LAST_UPDATED_DATE": "06/15/2021 13:00:08",
   "LAST_UPDATED_DAY": "2021-06-15",
   "ORG_ID": 1450402,
   "ORG_NAME": "UNIVERSITY OF MINNESOTA",
   "ORG_ADDRESS_1": "UNIVERSITY OF MINNESOTA TWIN CITIES",
   "ORG_ADDRESS_2": "450 MCNAMARA ALUMNI CENTER",
   "ORG_ADDRESS_3": "",
   "ORG_ADDRESS_4": "",
   "ORG_ADDRESS_5": "",
   "CITY": "MINNEAPOLIS",
   "STATE": "MN",
   "PHONE_NUMBER": "6126245599",
   "ORG_EMAIL": "awards@umn.edu"
 },
 {
   "USER_ID": "LangdonJJul690",
   "PERSON_ID": 78197874,
   "EMAIL": "LangdonJJul690@cancer.com",
   "NAME_PREFIX": "",
   "FIRST_NAME": "Julia",
   "MI_NAME": "J",
   "LAST_NAME": "Langdon",
   "NAME_SUFFIX": "",
   "STATUS_CODE": 1,
   "STATUS_DESCRIP": "Active",
   "ACCOUNT_CREATED_DATE": "06/02/2021 10:02:01",
   "ACCOUNT_UPDATED_DATE": "06/02/2021 13:05:45",
   "ACCOUNT_LAST_LOGIN_DATE": "06/02/2021 13:05:45",
   "LAST_UPDATED_DATE": "06/02/2021 13:05:45",
   "LAST_UPDATED_DAY": "2021-06-02",
   "ORG_ID": 1450402,
   "ORG_NAME": "UNIVERSITY OF MINNESOTA",
   "ORG_ADDRESS_1": "UNIVERSITY OF MINNESOTA TWIN CITIES",
   "ORG_ADDRESS_2": "450 MCNAMARA ALUMNI CENTER",
   "ORG_ADDRESS_3": "",
   "ORG_ADDRESS_4": "",
   "ORG_ADDRESS_5": "",
   "CITY": "MINNEAPOLIS",
   "STATE": "MN",
   "PHONE_NUMBER": "6126245599",
   "ORG_EMAIL": "awards@umn.edu"
 },
 {
   "USER_ID": "HowardTTim670",
   "PERSON_ID": 78203843,
   "EMAIL": "HowardTTim670@cancer.com",
   "NAME_PREFIX": "",
   "FIRST_NAME": "Tim",
   "MI_NAME": "T",
   "LAST_NAME": "Howard",
   "NAME_SUFFIX": "",
   "STATUS_CODE": 1,
   "STATUS_DESCRIP": "Active",
   "ACCOUNT_CREATED_DATE": "06/04/2021 11:26:57",
   "ACCOUNT_UPDATED_DATE": "06/15/2021 12:10:04",
   "ACCOUNT_LAST_LOGIN_DATE": "06/15/2021 12:10:04",
   "LAST_UPDATED_DATE": "06/15/2021 12:10:04",
   "LAST_UPDATED_DAY": "2021-06-15",
   "ORG_ID": 1450402,
   "ORG_NAME": "UNIVERSITY OF MINNESOTA",
   "ORG_ADDRESS_1": "UNIVERSITY OF MINNESOTA TWIN CITIES",
   "ORG_ADDRESS_2": "450 MCNAMARA ALUMNI CENTER",
   "ORG_ADDRESS_3": "",
   "ORG_ADDRESS_4": "",
   "ORG_ADDRESS_5": "",
   "CITY": "MINNEAPOLIS",
   "STATE": "MN",
   "PHONE_NUMBER": "6126245599",
   "ORG_EMAIL": "awards@umn.edu"
 },
 {
   "USER_ID": "LawrenceCCam806",
   "PERSON_ID": 78208474,
   "EMAIL": "LawrenceCCam806@cancer.com",
   "NAME_PREFIX": "",
   "FIRST_NAME": "Cameron",
   "MI_NAME": "C",
   "LAST_NAME": "Lawrence",
   "NAME_SUFFIX": "",
   "STATUS_CODE": 1,
   "STATUS_DESCRIP": "Active",
   "ACCOUNT_CREATED_DATE": "06/07/2021 11:11:18",
   "ACCOUNT_UPDATED_DATE": "06/08/2021 10:52:03",
   "ACCOUNT_LAST_LOGIN_DATE": "06/08/2021 10:51:41",
   "LAST_UPDATED_DATE": "06/08/2021 10:52:03",
   "LAST_UPDATED_DAY": "2021-06-08",
   "ORG_ID": 1450402,
   "ORG_NAME": "UNIVERSITY OF MINNESOTA",
   "ORG_ADDRESS_1": "UNIVERSITY OF MINNESOTA TWIN CITIES",
   "ORG_ADDRESS_2": "450 MCNAMARA ALUMNI CENTER",
   "ORG_ADDRESS_3": "",
   "ORG_ADDRESS_4": "",
   "ORG_ADDRESS_5": "",
   "CITY": "MINNEAPOLIS",
   "STATE": "MN",
   "PHONE_NUMBER": "6126245599",
   "ORG_EMAIL": "awards@umn.edu"
 },
 {
   "USER_ID": "BakerSSam838",
   "PERSON_ID": 78208837,
   "EMAIL": "BakerSSam838@cancer.com",
   "NAME_PREFIX": "",
   "FIRST_NAME": "Samantha",
   "MI_NAME": "S",
   "LAST_NAME": "Baker",
   "NAME_SUFFIX": "",
   "STATUS_CODE": 1,
   "STATUS_DESCRIP": "Active",
   "ACCOUNT_CREATED_DATE": "06/07/2021 11:57:54",
   "ACCOUNT_UPDATED_DATE": "06/08/2021 13:15:41",
   "ACCOUNT_LAST_LOGIN_DATE": "06/08/2021 13:15:41",
   "LAST_UPDATED_DATE": "06/08/2021 13:15:41",
   "LAST_UPDATED_DAY": "2021-06-08",
   "ORG_ID": 1450402,
   "ORG_NAME": "UNIVERSITY OF MINNESOTA",
   "ORG_ADDRESS_1": "UNIVERSITY OF MINNESOTA TWIN CITIES",
   "ORG_ADDRESS_2": "450 MCNAMARA ALUMNI CENTER",
   "ORG_ADDRESS_3": "",
   "ORG_ADDRESS_4": "",
   "ORG_ADDRESS_5": "",
   "CITY": "MINNEAPOLIS",
   "STATE": "MN",
   "PHONE_NUMBER": "6126245599",
   "ORG_EMAIL": "awards@umn.edu"
 },
 {
   "USER_ID": "ClarkSSar587",
   "PERSON_ID": 78211697,
   "EMAIL": "ClarkSSar587@cancer.com",
   "NAME_PREFIX": "",
   "FIRST_NAME": "Sarah",
   "MI_NAME": "S",
   "LAST_NAME": "Clark",
   "NAME_SUFFIX": "",
   "STATUS_CODE": 1,
   "STATUS_DESCRIP": "Active",
   "ACCOUNT_CREATED_DATE": "06/07/2021 16:57:07",
   "ACCOUNT_UPDATED_DATE": "06/14/2021 15:58:46",
   "ACCOUNT_LAST_LOGIN_DATE": "06/14/2021 15:58:46",
   "LAST_UPDATED_DATE": "06/14/2021 15:58:46",
   "LAST_UPDATED_DAY": "2021-06-14",
   "ORG_ID": 1450402,
   "ORG_NAME": "UNIVERSITY OF MINNESOTA",
   "ORG_ADDRESS_1": "UNIVERSITY OF MINNESOTA TWIN CITIES",
   "ORG_ADDRESS_2": "450 MCNAMARA ALUMNI CENTER",
   "ORG_ADDRESS_3": "",
   "ORG_ADDRESS_4": "",
   "ORG_ADDRESS_5": "",
   "CITY": "MINNEAPOLIS",
   "STATE": "MN",
   "PHONE_NUMBER": "6126245599",
   "ORG_EMAIL": "awards@umn.edu"
 },
 {
   "USER_ID": "WalshFFel842",
   "PERSON_ID": 78204434,
   "EMAIL": "WalshFFel842@cancer.com",
   "NAME_PREFIX": "",
   "FIRST_NAME": "Felicity",
   "MI_NAME": "F",
   "LAST_NAME": "Walsh",
   "NAME_SUFFIX": "",
   "STATUS_CODE": 1,
   "STATUS_DESCRIP": "Active",
   "ACCOUNT_CREATED_DATE": "06/04/2021 13:13:07",
   "ACCOUNT_UPDATED_DATE": "06/08/2021 10:50:16",
   "ACCOUNT_LAST_LOGIN_DATE": "06/08/2021 10:46:54",
   "LAST_UPDATED_DATE": "06/08/2021 10:50:16",
   "LAST_UPDATED_DAY": "2021-06-08",
   "ORG_ID": 1450402,
   "ORG_NAME": "UNIVERSITY OF MINNESOTA",
   "ORG_ADDRESS_1": "UNIVERSITY OF MINNESOTA TWIN CITIES",
   "ORG_ADDRESS_2": "450 MCNAMARA ALUMNI CENTER",
   "ORG_ADDRESS_3": "",
   "ORG_ADDRESS_4": "",
   "ORG_ADDRESS_5": "",
   "CITY": "MINNEAPOLIS",
   "STATE": "MN",
   "PHONE_NUMBER": "6126245599",
   "ORG_EMAIL": "awards@umn.edu"
 },
 {
   "USER_ID": "PeakeDDei68",
   "PERSON_ID": 78204878,
   "EMAIL": "PeakeDDei68@cancer.com",
   "NAME_PREFIX": "",
   "FIRST_NAME": "Deirdre",
   "MI_NAME": "D",
   "LAST_NAME": "Peake",
   "NAME_SUFFIX": "",
   "STATUS_CODE": 1,
   "STATUS_DESCRIP": "Active",
   "ACCOUNT_CREATED_DATE": "06/04/2021 14:15:52",
   "ACCOUNT_UPDATED_DATE": "06/08/2021 11:40:49",
   "ACCOUNT_LAST_LOGIN_DATE": "06/08/2021 11:40:49",
   "LAST_UPDATED_DATE": "06/08/2021 11:40:49",
   "LAST_UPDATED_DAY": "2021-06-08",
   "ORG_ID": 1450402,
   "ORG_NAME": "UNIVERSITY OF MINNESOTA",
   "ORG_ADDRESS_1": "UNIVERSITY OF MINNESOTA TWIN CITIES",
   "ORG_ADDRESS_2": "450 MCNAMARA ALUMNI CENTER",
   "ORG_ADDRESS_3": "",
   "ORG_ADDRESS_4": "",
   "ORG_ADDRESS_5": "",
   "CITY": "MINNEAPOLIS",
   "STATE": "MN",
   "PHONE_NUMBER": "6126245599",
   "ORG_EMAIL": "awards@umn.edu"
 },
 {
   "USER_ID": "HemmingsVVir755",
   "PERSON_ID": 78204928,
   "EMAIL": "HemmingsVVir755@cancer.com",
   "NAME_PREFIX": "",
   "FIRST_NAME": "Virginia",
   "MI_NAME": "V",
   "LAST_NAME": "Hemmings",
   "NAME_SUFFIX": "",
   "STATUS_CODE": 1,
   "STATUS_DESCRIP": "Active",
   "ACCOUNT_CREATED_DATE": "06/04/2021 14:22:57",
   "ACCOUNT_UPDATED_DATE": "06/08/2021 23:51:13",
   "ACCOUNT_LAST_LOGIN_DATE": "06/08/2021 23:50:02",
   "LAST_UPDATED_DATE": "06/08/2021 23:51:13",
   "LAST_UPDATED_DAY": "2021-06-08",
   "ORG_ID": 1450402,
   "ORG_NAME": "UNIVERSITY OF MINNESOTA",
   "ORG_ADDRESS_1": "UNIVERSITY OF MINNESOTA TWIN CITIES",
   "ORG_ADDRESS_2": "450 MCNAMARA ALUMNI CENTER",
   "ORG_ADDRESS_3": "",
   "ORG_ADDRESS_4": "",
   "ORG_ADDRESS_5": "",
   "CITY": "MINNEAPOLIS",
   "STATE": "MN",
   "PHONE_NUMBER": "6126245599",
   "ORG_EMAIL": "awards@umn.edu"
 },
 {
   "USER_ID": "PaigeHHar11",
   "PERSON_ID": 78205274,
   "EMAIL": "PaigeHHar11@cancer.com",
   "NAME_PREFIX": "Ms",
   "FIRST_NAME": "Harry",
   "MI_NAME": "H",
   "LAST_NAME": "Paige",
   "NAME_SUFFIX": "",
   "STATUS_CODE": 1,
   "STATUS_DESCRIP": "Active",
   "ACCOUNT_CREATED_DATE": "06/04/2021 15:02:59",
   "ACCOUNT_UPDATED_DATE": "06/08/2021 10:28:48",
   "ACCOUNT_LAST_LOGIN_DATE": "06/08/2021 10:28:48",
   "LAST_UPDATED_DATE": "06/08/2021 10:28:48",
   "LAST_UPDATED_DAY": "2021-06-08",
   "ORG_ID": 1450402,
   "ORG_NAME": "UNIVERSITY OF MINNESOTA",
   "ORG_ADDRESS_1": "UNIVERSITY OF MINNESOTA TWIN CITIES",
   "ORG_ADDRESS_2": "450 MCNAMARA ALUMNI CENTER",
   "ORG_ADDRESS_3": "",
   "ORG_ADDRESS_4": "",
   "ORG_ADDRESS_5": "",
   "CITY": "MINNEAPOLIS",
   "STATE": "MN",
   "PHONE_NUMBER": "6126245599",
   "ORG_EMAIL": "awards@umn.edu"
 },
 {
   "USER_ID": "JamesDDia91",
   "PERSON_ID": 78205715,
   "EMAIL": "JamesDDia91@cancer.com",
   "NAME_PREFIX": "",
   "FIRST_NAME": "Diane",
   "MI_NAME": "D",
   "LAST_NAME": "James",
   "NAME_SUFFIX": "",
   "STATUS_CODE": 1,
   "STATUS_DESCRIP": "Active",
   "ACCOUNT_CREATED_DATE": "06/04/2021 16:00:23",
   "ACCOUNT_UPDATED_DATE": "06/10/2021 09:16:32",
   "ACCOUNT_LAST_LOGIN_DATE": "06/10/2021 09:14:31",
   "LAST_UPDATED_DATE": "06/10/2021 09:16:32",
   "LAST_UPDATED_DAY": "2021-06-10",
   "ORG_ID": 1450402,
   "ORG_NAME": "UNIVERSITY OF MINNESOTA",
   "ORG_ADDRESS_1": "UNIVERSITY OF MINNESOTA TWIN CITIES",
   "ORG_ADDRESS_2": "450 MCNAMARA ALUMNI CENTER",
   "ORG_ADDRESS_3": "",
   "ORG_ADDRESS_4": "",
   "ORG_ADDRESS_5": "",
   "CITY": "MINNEAPOLIS",
   "STATE": "MN",
   "PHONE_NUMBER": "6126245599",
   "ORG_EMAIL": "awards@umn.edu"
 },
 {
   "USER_ID": "NashJJas948",
   "PERSON_ID": 78217310,
   "EMAIL": "NashJJas948@cancer.com",
   "NAME_PREFIX": "",
   "FIRST_NAME": "Jasmine",
   "MI_NAME": "J",
   "LAST_NAME": "Nash",
   "NAME_SUFFIX": "",
   "STATUS_CODE": 1,
   "STATUS_DESCRIP": "Active",
   "ACCOUNT_CREATED_DATE": "06/10/2021 09:24:30",
   "ACCOUNT_UPDATED_DATE": "06/15/2021 12:41:41",
   "ACCOUNT_LAST_LOGIN_DATE": "06/15/2021 12:41:41",
   "LAST_UPDATED_DATE": "06/15/2021 12:41:41",
   "LAST_UPDATED_DAY": "2021-06-15",
   "ORG_ID": 1450402,
   "ORG_NAME": "UNIVERSITY OF MINNESOTA",
   "ORG_ADDRESS_1": "UNIVERSITY OF MINNESOTA TWIN CITIES",
   "ORG_ADDRESS_2": "450 MCNAMARA ALUMNI CENTER",
   "ORG_ADDRESS_3": "",
   "ORG_ADDRESS_4": "",
   "ORG_ADDRESS_5": "",
   "CITY": "MINNEAPOLIS",
   "STATE": "MN",
   "PHONE_NUMBER": "6126245599",
   "ORG_EMAIL": "awards@umn.edu"
 },
 {
   "USER_ID": "PayneAAme228",
   "PERSON_ID": 78217345,
   "EMAIL": "PayneAAme228@cancer.com",
   "NAME_PREFIX": "Mr",
   "FIRST_NAME": "Amelia",
   "MI_NAME": "A",
   "LAST_NAME": "Payne",
   "NAME_SUFFIX": "",
   "STATUS_CODE": 1,
   "STATUS_DESCRIP": "Active",
   "ACCOUNT_CREATED_DATE": "06/10/2021 09:45:06",
   "ACCOUNT_UPDATED_DATE": "06/11/2021 11:32:46",
   "ACCOUNT_LAST_LOGIN_DATE": "06/11/2021 11:13:46",
   "LAST_UPDATED_DATE": "06/11/2021 11:32:46",
   "LAST_UPDATED_DAY": "2021-06-11",
   "ORG_ID": 1450402,
   "ORG_NAME": "UNIVERSITY OF MINNESOTA",
   "ORG_ADDRESS_1": "UNIVERSITY OF MINNESOTA TWIN CITIES",
   "ORG_ADDRESS_2": "450 MCNAMARA ALUMNI CENTER",
   "ORG_ADDRESS_3": "",
   "ORG_ADDRESS_4": "",
   "ORG_ADDRESS_5": "",
   "CITY": "MINNEAPOLIS",
   "STATE": "MN",
   "PHONE_NUMBER": "6126245599",
   "ORG_EMAIL": "awards@umn.edu"
 },
 {
   "USER_ID": "MarshallTTim677",
   "PERSON_ID": 78207901,
   "EMAIL": "MarshallTTim677@cancer.com",
   "NAME_PREFIX": "",
   "FIRST_NAME": "Tim",
   "MI_NAME": "T",
   "LAST_NAME": "Marshall",
   "NAME_SUFFIX": "",
   "STATUS_CODE": 1,
   "STATUS_DESCRIP": "Active",
   "ACCOUNT_CREATED_DATE": "06/07/2021 09:22:04",
   "ACCOUNT_UPDATED_DATE": "06/07/2021 15:23:41",
   "ACCOUNT_LAST_LOGIN_DATE": "06/07/2021 15:15:20",
   "LAST_UPDATED_DATE": "06/07/2021 15:23:41",
   "LAST_UPDATED_DAY": "2021-06-07",
   "ORG_ID": 1450402,
   "ORG_NAME": "UNIVERSITY OF MINNESOTA",
   "ORG_ADDRESS_1": "UNIVERSITY OF MINNESOTA TWIN CITIES",
   "ORG_ADDRESS_2": "450 MCNAMARA ALUMNI CENTER",
   "ORG_ADDRESS_3": "",
   "ORG_ADDRESS_4": "",
   "ORG_ADDRESS_5": "",
   "CITY": "MINNEAPOLIS",
   "STATE": "MN",
   "PHONE_NUMBER": "6126245599",
   "ORG_EMAIL": "awards@umn.edu"
 },
 {
   "USER_ID": "SmithKKev470",
   "PERSON_ID": 78205181,
   "EMAIL": "SmithKKev470@cancer.com",
   "NAME_PREFIX": "",
   "FIRST_NAME": "Kevin",
   "MI_NAME": "K",
   "LAST_NAME": "Smith",
   "NAME_SUFFIX": "",
   "STATUS_CODE": 1,
   "STATUS_DESCRIP": "Active",
   "ACCOUNT_CREATED_DATE": "06/04/2021 14:52:30",
   "ACCOUNT_UPDATED_DATE": "06/08/2021 10:52:48",
   "ACCOUNT_LAST_LOGIN_DATE": "06/08/2021 10:50:02",
   "LAST_UPDATED_DATE": "06/08/2021 10:52:48",
   "LAST_UPDATED_DAY": "2021-06-08",
   "ORG_ID": 1450402,
   "ORG_NAME": "UNIVERSITY OF MINNESOTA",
   "ORG_ADDRESS_1": "UNIVERSITY OF MINNESOTA TWIN CITIES",
   "ORG_ADDRESS_2": "450 MCNAMARA ALUMNI CENTER",
   "ORG_ADDRESS_3": "",
   "ORG_ADDRESS_4": "",
   "ORG_ADDRESS_5": "",
   "CITY": "MINNEAPOLIS",
   "STATE": "MN",
   "PHONE_NUMBER": "6126245599",
   "ORG_EMAIL": "awards@umn.edu"
 },
 {
   "USER_ID": "WalkerOOli252",
   "PERSON_ID": 78206033,
   "EMAIL": "WalkerOOli252@cancer.com",
   "NAME_PREFIX": "",
   "FIRST_NAME": "Oliver",
   "MI_NAME": "O",
   "LAST_NAME": "Walker",
   "NAME_SUFFIX": "",
   "STATUS_CODE": 1,
   "STATUS_DESCRIP": "Active",
   "ACCOUNT_CREATED_DATE": "06/04/2021 16:47:07",
   "ACCOUNT_UPDATED_DATE": "06/09/2021 10:09:59",
   "ACCOUNT_LAST_LOGIN_DATE": "06/09/2021 10:09:59",
   "LAST_UPDATED_DATE": "06/09/2021 10:09:59",
   "LAST_UPDATED_DAY": "2021-06-09",
   "ORG_ID": 1450402,
   "ORG_NAME": "UNIVERSITY OF MINNESOTA",
   "ORG_ADDRESS_1": "UNIVERSITY OF MINNESOTA TWIN CITIES",
   "ORG_ADDRESS_2": "450 MCNAMARA ALUMNI CENTER",
   "ORG_ADDRESS_3": "",
   "ORG_ADDRESS_4": "",
   "ORG_ADDRESS_5": "",
   "CITY": "MINNEAPOLIS",
   "STATE": "MN",
   "PHONE_NUMBER": "6126245599",
   "ORG_EMAIL": "awards@umn.edu"
 },
 {
   "USER_ID": "WalkerEEri774",
   "PERSON_ID": 78207836,
   "EMAIL": "WalkerEEri774@cancer.com",
   "NAME_PREFIX": "",
   "FIRST_NAME": "Eric",
   "MI_NAME": "E",
   "LAST_NAME": "Walker",
   "NAME_SUFFIX": "",
   "STATUS_CODE": 1,
   "STATUS_DESCRIP": "Active",
   "ACCOUNT_CREATED_DATE": "06/07/2021 09:08:12",
   "ACCOUNT_UPDATED_DATE": "06/08/2021 16:12:37",
   "ACCOUNT_LAST_LOGIN_DATE": "06/08/2021 16:12:37",
   "LAST_UPDATED_DATE": "06/08/2021 16:12:37",
   "LAST_UPDATED_DAY": "2021-06-08",
   "ORG_ID": 1450402,
   "ORG_NAME": "UNIVERSITY OF MINNESOTA",
   "ORG_ADDRESS_1": "UNIVERSITY OF MINNESOTA TWIN CITIES",
   "ORG_ADDRESS_2": "450 MCNAMARA ALUMNI CENTER",
   "ORG_ADDRESS_3": "",
   "ORG_ADDRESS_4": "",
   "ORG_ADDRESS_5": "",
   "CITY": "MINNEAPOLIS",
   "STATE": "MN",
   "PHONE_NUMBER": "6126245599",
   "ORG_EMAIL": "awards@umn.edu"
 },
 {
   "USER_ID": "ThomsonKKev117",
   "PERSON_ID": 78208535,
   "EMAIL": "ThomsonKKev117@cancer.com",
   "NAME_PREFIX": "Mr",
   "FIRST_NAME": "Kevin",
   "MI_NAME": "K",
   "LAST_NAME": "Thomson",
   "NAME_SUFFIX": "",
   "STATUS_CODE": 1,
   "STATUS_DESCRIP": "Active",
   "ACCOUNT_CREATED_DATE": "06/07/2021 11:20:06",
   "ACCOUNT_UPDATED_DATE": "06/10/2021 16:24:18",
   "ACCOUNT_LAST_LOGIN_DATE": "06/10/2021 16:24:18",
   "LAST_UPDATED_DATE": "06/10/2021 16:24:18",
   "LAST_UPDATED_DAY": "2021-06-10",
   "ORG_ID": 1450402,
   "ORG_NAME": "UNIVERSITY OF MINNESOTA",
   "ORG_ADDRESS_1": "UNIVERSITY OF MINNESOTA TWIN CITIES",
   "ORG_ADDRESS_2": "450 MCNAMARA ALUMNI CENTER",
   "ORG_ADDRESS_3": "",
   "ORG_ADDRESS_4": "",
   "ORG_ADDRESS_5": "",
   "CITY": "MINNEAPOLIS",
   "STATE": "MN",
   "PHONE_NUMBER": "6126245599",
   "ORG_EMAIL": "awards@umn.edu"
 },
 {
   "USER_ID": "MacLeodSSal785",
   "PERSON_ID": 78205980,
   "EMAIL": "MacLeodSSal785@cancer.com",
   "NAME_PREFIX": "",
   "FIRST_NAME": "Sally",
   "MI_NAME": "S",
   "LAST_NAME": "MacLeod",
   "NAME_SUFFIX": "",
   "STATUS_CODE": 1,
   "STATUS_DESCRIP": "Active",
   "ACCOUNT_CREATED_DATE": "06/04/2021 16:40:48",
   "ACCOUNT_UPDATED_DATE": "06/08/2021 10:54:07",
   "ACCOUNT_LAST_LOGIN_DATE": "06/08/2021 10:24:28",
   "LAST_UPDATED_DATE": "06/08/2021 10:54:07",
   "LAST_UPDATED_DAY": "2021-06-08",
   "ORG_ID": 1450402,
   "ORG_NAME": "UNIVERSITY OF MINNESOTA",
   "ORG_ADDRESS_1": "UNIVERSITY OF MINNESOTA TWIN CITIES",
   "ORG_ADDRESS_2": "450 MCNAMARA ALUMNI CENTER",
   "ORG_ADDRESS_3": "",
   "ORG_ADDRESS_4": "",
   "ORG_ADDRESS_5": "",
   "CITY": "MINNEAPOLIS",
   "STATE": "MN",
   "PHONE_NUMBER": "6126245599",
   "ORG_EMAIL": "awards@umn.edu"
 },
 {
   "USER_ID": "ClarkFFio638",
   "PERSON_ID": 78206082,
   "EMAIL": "ClarkFFio638@cancer.com",
   "NAME_PREFIX": "",
   "FIRST_NAME": "Fiona",
   "MI_NAME": "F",
   "LAST_NAME": "Clark",
   "NAME_SUFFIX": "",
   "STATUS_CODE": 1,
   "STATUS_DESCRIP": "Active",
   "ACCOUNT_CREATED_DATE": "06/04/2021 16:52:08",
   "ACCOUNT_UPDATED_DATE": "06/15/2021 17:24:21",
   "ACCOUNT_LAST_LOGIN_DATE": "06/15/2021 17:24:21",
   "LAST_UPDATED_DATE": "06/15/2021 17:24:21",
   "LAST_UPDATED_DAY": "2021-06-15",
   "ORG_ID": 1450402,
   "ORG_NAME": "UNIVERSITY OF MINNESOTA",
   "ORG_ADDRESS_1": "UNIVERSITY OF MINNESOTA TWIN CITIES",
   "ORG_ADDRESS_2": "450 MCNAMARA ALUMNI CENTER",
   "ORG_ADDRESS_3": "",
   "ORG_ADDRESS_4": "",
   "ORG_ADDRESS_5": "",
   "CITY": "MINNEAPOLIS",
   "STATE": "MN",
   "PHONE_NUMBER": "6126245599",
   "ORG_EMAIL": "awards@umn.edu"
 },
 {
   "USER_ID": "OliverLLuk393",
   "PERSON_ID": 78219766,
   "EMAIL": "OliverLLuk393@cancer.com",
   "NAME_PREFIX": "",
   "FIRST_NAME": "Luke",
   "MI_NAME": "L",
   "LAST_NAME": "Oliver",
   "NAME_SUFFIX": "",
   "STATUS_CODE": 1,
   "STATUS_DESCRIP": "Active",
   "ACCOUNT_CREATED_DATE": "06/11/2021 10:46:45",
   "ACCOUNT_UPDATED_DATE": "06/11/2021 19:02:10",
   "ACCOUNT_LAST_LOGIN_DATE": "06/11/2021 18:41:44",
   "LAST_UPDATED_DATE": "06/11/2021 19:02:10",
   "LAST_UPDATED_DAY": "2021-06-11",
   "ORG_ID": 1450402,
   "ORG_NAME": "UNIVERSITY OF MINNESOTA",
   "ORG_ADDRESS_1": "UNIVERSITY OF MINNESOTA TWIN CITIES",
   "ORG_ADDRESS_2": "450 MCNAMARA ALUMNI CENTER",
   "ORG_ADDRESS_3": "",
   "ORG_ADDRESS_4": "",
   "ORG_ADDRESS_5": "",
   "CITY": "MINNEAPOLIS",
   "STATE": "MN",
   "PHONE_NUMBER": "6126245599",
   "ORG_EMAIL": "awards@umn.edu"
 },
 {
   "USER_ID": "BerryPPen187",
   "PERSON_ID": 78203863,
   "EMAIL": "BerryPPen187@cancer.com",
   "NAME_PREFIX": "",
   "FIRST_NAME": "Penelope",
   "MI_NAME": "P",
   "LAST_NAME": "Berry",
   "NAME_SUFFIX": "",
   "STATUS_CODE": 1,
   "STATUS_DESCRIP": "Active",
   "ACCOUNT_CREATED_DATE": "06/04/2021 11:33:03",
   "ACCOUNT_UPDATED_DATE": "",
   "ACCOUNT_LAST_LOGIN_DATE": "",
   "LAST_UPDATED_DATE": "06/04/2021 11:33:03",
   "LAST_UPDATED_DAY": "2021-06-04",
   "ORG_ID": 1450402,
   "ORG_NAME": "UNIVERSITY OF MINNESOTA",
   "ORG_ADDRESS_1": "UNIVERSITY OF MINNESOTA TWIN CITIES",
   "ORG_ADDRESS_2": "450 MCNAMARA ALUMNI CENTER",
   "ORG_ADDRESS_3": "",
   "ORG_ADDRESS_4": "",
   "ORG_ADDRESS_5": "",
   "CITY": "MINNEAPOLIS",
   "STATE": "MN",
   "PHONE_NUMBER": "6126245599",
   "ORG_EMAIL": "awards@umn.edu"
 },
 {
   "USER_ID": "HendersonDDyl562",
   "PERSON_ID": 78204429,
   "EMAIL": "HendersonDDyl562@cancer.com",
   "NAME_PREFIX": "",
   "FIRST_NAME": "Dylan",
   "MI_NAME": "D",
   "LAST_NAME": "Henderson",
   "NAME_SUFFIX": "",
   "STATUS_CODE": 1,
   "STATUS_DESCRIP": "Active",
   "ACCOUNT_CREATED_DATE": "06/04/2021 13:09:41",
   "ACCOUNT_UPDATED_DATE": "06/08/2021 11:16:26",
   "ACCOUNT_LAST_LOGIN_DATE": "06/08/2021 11:11:01",
   "LAST_UPDATED_DATE": "06/08/2021 11:16:26",
   "LAST_UPDATED_DAY": "2021-06-08",
   "ORG_ID": 1450402,
   "ORG_NAME": "UNIVERSITY OF MINNESOTA",
   "ORG_ADDRESS_1": "UNIVERSITY OF MINNESOTA TWIN CITIES",
   "ORG_ADDRESS_2": "450 MCNAMARA ALUMNI CENTER",
   "ORG_ADDRESS_3": "",
   "ORG_ADDRESS_4": "",
   "ORG_ADDRESS_5": "",
   "CITY": "MINNEAPOLIS",
   "STATE": "MN",
   "PHONE_NUMBER": "6126245599",
   "ORG_EMAIL": "awards@umn.edu"
 },
 {
   "USER_ID": "WelchGGav10",
   "PERSON_ID": 78206192,
   "EMAIL": "WelchGGav10@cancer.com",
   "NAME_PREFIX": "",
   "FIRST_NAME": "Gavin",
   "MI_NAME": "G",
   "LAST_NAME": "Welch",
   "NAME_SUFFIX": "",
   "STATUS_CODE": 1,
   "STATUS_DESCRIP": "Active",
   "ACCOUNT_CREATED_DATE": "06/04/2021 17:06:12",
   "ACCOUNT_UPDATED_DATE": "06/08/2021 10:39:43",
   "ACCOUNT_LAST_LOGIN_DATE": "06/08/2021 10:36:36",
   "LAST_UPDATED_DATE": "06/08/2021 10:39:43",
   "LAST_UPDATED_DAY": "2021-06-08",
   "ORG_ID": 1450402,
   "ORG_NAME": "UNIVERSITY OF MINNESOTA",
   "ORG_ADDRESS_1": "UNIVERSITY OF MINNESOTA TWIN CITIES",
   "ORG_ADDRESS_2": "450 MCNAMARA ALUMNI CENTER",
   "ORG_ADDRESS_3": "",
   "ORG_ADDRESS_4": "",
   "ORG_ADDRESS_5": "",
   "CITY": "MINNEAPOLIS",
   "STATE": "MN",
   "PHONE_NUMBER": "6126245599",
   "ORG_EMAIL": "awards@umn.edu"
 },
 {
   "USER_ID": "VanceLLau946",
   "PERSON_ID": 78217543,
   "EMAIL": "VanceLLau946@cancer.com",
   "NAME_PREFIX": "",
   "FIRST_NAME": "Lauren",
   "MI_NAME": "L",
   "LAST_NAME": "Vance",
   "NAME_SUFFIX": "",
   "STATUS_CODE": 1,
   "STATUS_DESCRIP": "Active",
   "ACCOUNT_CREATED_DATE": "06/10/2021 11:17:34",
   "ACCOUNT_UPDATED_DATE": "06/15/2021 09:27:58",
   "ACCOUNT_LAST_LOGIN_DATE": "06/15/2021 09:27:58",
   "LAST_UPDATED_DATE": "06/15/2021 09:27:58",
   "LAST_UPDATED_DAY": "2021-06-15",
   "ORG_ID": 1450402,
   "ORG_NAME": "UNIVERSITY OF MINNESOTA",
   "ORG_ADDRESS_1": "UNIVERSITY OF MINNESOTA TWIN CITIES",
   "ORG_ADDRESS_2": "450 MCNAMARA ALUMNI CENTER",
   "ORG_ADDRESS_3": "",
   "ORG_ADDRESS_4": "",
   "ORG_ADDRESS_5": "",
   "CITY": "MINNEAPOLIS",
   "STATE": "MN",
   "PHONE_NUMBER": "6126245599",
   "ORG_EMAIL": "awards@umn.edu"
 },
 {
   "USER_ID": "KingNNei667",
   "PERSON_ID": 78217666,
   "EMAIL": "KingNNei667@cancer.com",
   "NAME_PREFIX": "",
   "FIRST_NAME": "Neil",
   "MI_NAME": "N",
   "LAST_NAME": "King",
   "NAME_SUFFIX": "",
   "STATUS_CODE": 1,
   "STATUS_DESCRIP": "Active",
   "ACCOUNT_CREATED_DATE": "06/10/2021 11:55:59",
